Title,Cleaned_Text,Author,Score,Comments,Created_UTC,URL,Cluster,Sentiment_Score,Sentiment
"ROG Xbox Ally runs better on Linux than the Windows it ships with — new test shows up to 32% higher FPS, with more stable framerates and quicker sleep resume times",rog xbox ally run well linux window ship new test show high fps stable framerate quick sleep resume time,chrisdh79,352,33,2025-10-22 15:06:56,https://www.reddit.com/r/technology/comments/1odauc7/rog_xbox_ally_runs_better_on_linux_than_the/,2,0.659,Positive
"AI assistants make widespread errors about the news, new research shows",ai assistant make widespread error news new research show,d01100100,130,26,2025-10-22 19:52:03,https://www.reddit.com/r/technology/comments/1odilgg/ai_assistants_make_widespread_errors_about_the/,2,-0.34,Negative
"TSMC's new 2nm chip will reportedly cost 50% more — get ready for more expensive laptops and phones | AMD, Apple, Nvidia and others may have to raise prices yet again",tsmcs new nm chip reportedly cost get ready expensive laptop phone amd apple nvidia other may raise price yet,chrisdh79,520,157,2025-10-22 12:28:54,https://www.reddit.com/r/technology/comments/1od6w9e/tsmcs_new_2nm_chip_will_reportedly_cost_50_more/,0,0.4173,Positive
New Zealand parliament to debate teen social media ban,new zealand parliament debate teen social medium ban,vriska1,15,3,2025-10-23 06:08:59,https://www.reddit.com/r/technology/comments/1odvon4/new_zealand_parliament_to_debate_teen_social/,1,-0.5574,Negative
How China Raced Ahead of the U.S. on Nuclear Power,china race ahead we nuclear power,rezwenn,11,12,2025-10-23 09:20:08,https://www.reddit.com/r/technology/comments/1odylqv/how_china_raced_ahead_of_the_us_on_nuclear_power/,1,0.0,Neutral
Jensen Huang says Nvidia went from 95% market share in China to 0%—‘I can’t imagine any policymaker thinking that that’s a good idea’,jensen huang say nvidia go market share china can not imagine policymaker thinking that s good idea,lurker_bee,2062,130,2025-10-22 03:32:22,https://www.reddit.com/r/technology/comments/1ocxod4/jensen_huang_says_nvidia_went_from_95_market/,4,0.6249,Positive
"16-inch laptop with Blu-ray drive, USB 4 and AMD Ryzen 7: Fujitsu FMV Note A launches",inch laptop bluray drive usb amd ryzen fujitsu fmv note launch,moeka_8962,0,0,2025-10-24 05:12:24,https://www.reddit.com/r/technology/comments/1oep8u8/16inch_laptop_with_bluray_drive_usb_4_and_amd/,2,0.0,Neutral
A new autonomous fighter jet just broke cover. It's powered by the same AI brain that flew an F-16 through a dogfight.,new autonomous fighter jet break cover power ai brain fly f dogfight,MetaKnowing,3,9,2025-10-23 14:26:53,https://www.reddit.com/r/technology/comments/1oe4pne/a_new_autonomous_fighter_jet_just_broke_cover_its/,2,-0.296,Negative
Hot-Rodder Triples the HP of His Pontiac V8 With 3D-Printed Parts to Win a Bet,hotrodder triple hp pontiac v dprinted part win bet,TripleShotPls,1,3,2025-10-23 16:22:09,https://www.reddit.com/r/technology/comments/1oe7r6q/hotrodder_triples_the_hp_of_his_pontiac_v8_with/,0,0.5859,Positive
Finally: NASCAR Engineer Performs Lightning McQueen Aero Analysis,finally nascar engineer perform lightne mcqueen aero analysis,TripleShotPls,44,20,2025-10-22 23:27:30,https://www.reddit.com/r/technology/comments/1odnwnn/finally_nascar_engineer_performs_lightning/,1,0.0,Neutral
"Microsoft breaks, then quickly fixes Windows Recovery Environment bug that bricked USB input devices | In the age of AI-written patches, we highly suggest turning off automatic Windows updates",microsoft break quickly fix window recovery environment bug bricke usb input device age aiwritten patch highly suggest turn automatic window update,chrisdh79,425,56,2025-10-22 11:09:45,https://www.reddit.com/r/technology/comments/1od5alh/microsoft_breaks_then_quickly_fixes_windows/,2,0.0,Neutral
"It isn't layoffs, but Amazon has a stark new warning about the future of jobs",be not layoff amazon stark new warning future job,abrownn,132,99,2025-10-22 17:19:29,https://www.reddit.com/r/technology/comments/1odegun/it_isnt_layoffs_but_amazon_has_a_stark_new/,4,-0.5963,Negative
PSA: A popular thermal paste is destroying CPUs and heatsinks | Beware while buying cheap thermal pastes from unknown brands,psa popular thermal paste destroy cpus heatsink beware buy cheap thermal paste unknown brand,chrisdh79,456,57,2025-10-22 10:28:55,https://www.reddit.com/r/technology/comments/1od4kor/psa_a_popular_thermal_paste_is_destroying_cpus/,3,-0.2023,Negative
"AWS crash causes $2,000 Smart Beds to overheat and get stuck upright",aw crash cause smart bed overheat get stuck upright,ImCalcium,20142,1394,2025-10-21 16:04:12,https://www.reddit.com/r/technology/comments/1ocgytv/aws_crash_causes_2000_smart_beds_to_overheat_and/,4,-0.25,Negative
How Apple’s walled garden protects ICE,apple wall garden protect ice,QuicklyThisWay,215,29,2025-10-22 14:02:46,https://www.reddit.com/r/technology/comments/1od95ct/how_apples_walled_garden_protects_ice/,1,0.3182,Positive
"Tesla Model Y rebounds to win September sales race; Renault Clio, Dacia Sandero round out top 3",tesla model rebound win september sale race renault clio dacia sandero round top,Hockeyshot39,0,4,2025-10-24 07:32:37,https://www.reddit.com/r/technology/comments/1oerfey/tesla_model_y_rebounds_to_win_september_sales/,0,0.6808,Positive
DC’s shutdown is hurting government tech workers — and everyone else | Some former government tech workers are stepping in to help get them through.,dcs shutdown hurt government tech worker everyone else former government tech worker step help get,chrisdh79,179,3,2025-10-22 14:52:27,https://www.reddit.com/r/technology/comments/1odag0h/dcs_shutdown_is_hurting_government_tech_workers/,0,0.0,Neutral
"Clickbait Gives AI Models ‘Brain Rot,’ Researchers Find | Brain rot doesn't require a brain, just this one simple trick.",clickbait give ai model brain rot researcher find brain rot do not require brain one simple trick,chrisdh79,221,24,2025-10-22 13:19:45,https://www.reddit.com/r/technology/comments/1od82px/clickbait_gives_ai_models_brain_rot_researchers/,3,-0.0516,Negative
"Chinese robovan startup Neolix raises $600m for tech, product development",chinese robovan startup neolix raise tech product development,NikkeiAsia,8,2,2025-10-23 08:46:16,https://www.reddit.com/r/technology/comments/1ody2x8/chinese_robovan_startup_neolix_raises_600m_for/,0,0.0,Neutral
"GM says hands-free, eyes-off driving is coming to Escalade IQ in 2028",gm say handsfree eyesoff drive come escalade iq,DonkeyFuel,141,96,2025-10-22 15:15:14,https://www.reddit.com/r/technology/comments/1odb289/gm_says_handsfree_eyesoff_driving_is_coming_to/,4,0.0,Neutral
"SpaceX disables 2,500 Starlink terminals allegedly used by Asian scam centers | Starlink not allowed in Myanmar, but scammers reportedly use it “on a huge scale.”",spacex disable starlink terminal allegedly use asian scam center starlink allow myanmar scammer reportedly use huge scale,ControlCAD,49,1,2025-10-22 20:23:18,https://www.reddit.com/r/technology/comments/1odjfi8/spacex_disables_2500_starlink_terminals_allegedly/,3,0.1531,Positive
People Who Say They’re Experiencing AI Psychosis Beg the FTC for Help,people say they re experience ai psychosis beg ftc help,MetaKnowing,179,64,2025-10-22 11:56:20,https://www.reddit.com/r/technology/comments/1od66y1/people_who_say_theyre_experiencing_ai_psychosis/,3,0.4019,Positive
Apple alerts exploit developer that his iPhone was targeted with government spyware,apple alert exploit developer iphone target government spyware,postalex,99,6,2025-10-22 14:40:30,https://www.reddit.com/r/technology/comments/1oda4kn/apple_alerts_exploit_developer_that_his_iphone/,0,-0.1027,Negative
DeepSeek’s Surge in Africa Reveals China’s AI Power Grab,deepseeks surge africa reveal chinas ai power grab,joe4942,19,16,2025-10-22 23:06:41,https://www.reddit.com/r/technology/comments/1odnfnq/deepseeks_surge_in_africa_reveals_chinas_ai_power/,0,0.0,Neutral
"Palworld studio Pocketpair says its new publishing division won't handle games that use generative AI: 'We don't believe in it' | Pocketpair Publishing boss John Buckley says we're already starting to see a flood of 'really low-quality, AI-made games' on Steam and other storefronts.",palworld studio pocketpair say new publishing division will not handle game use generative ai do not believe pocketpair publishing boss john buckley say already starting see flood really lowquality aimade game steam storefront,ControlCAD,513,69,2025-10-22 04:18:46,https://www.reddit.com/r/technology/comments/1ocyl46/palworld_studio_pocketpair_says_its_new/,1,0.0,Neutral
TikTok Won’t Say If It’s Giving ICE Your Data,tiktok will not say give ice datum,holyfruits,2366,244,2025-10-21 19:36:51,https://www.reddit.com/r/technology/comments/1ocmokz/tiktok_wont_say_if_its_giving_ice_your_data/,2,0.34,Positive
What it's like to have an AI wearable record everything you say,like ai wearable record everything say,Delicious_Adeptness9,0,8,2025-10-24 00:04:48,https://www.reddit.com/r/technology/comments/1oejawr/what_its_like_to_have_an_ai_wearable_record/,3,0.3612,Positive
Cards Against Humanity lawsuit forced SpaceX to vacate land on US/Mexico border | CAH: Trespassing lawsuit forced SpaceX to “pack up the space garbage” and leave.,card humanity lawsuit force spacex vacate land usmexico border cah trespassing lawsuit force spacex pack space garbage leave,ControlCAD,2577,55,2025-10-21 18:21:01,https://www.reddit.com/r/technology/comments/1ockmvu/cards_against_humanity_lawsuit_forced_spacex_to/,2,-0.8402,Negative
A SiriusXM Update Sent Some Audi Screens Into A Forced-Reboot Loop For Months,siriusxm update send audi screen forcedreboot loop month,TripleShotPls,17,1,2025-10-22 21:22:35,https://www.reddit.com/r/technology/comments/1odkyow/a_siriusxm_update_sent_some_audi_screens_into_a/,0,0.0,Neutral
"Before Advocating To Repeal Section 230, It Helps To First Understand How It Works",advocate repeal section helps first understand work,StraightedgexLiberal,10,27,2025-10-22 22:59:45,https://www.reddit.com/r/technology/comments/1odn9pc/before_advocating_to_repeal_section_230_it_helps/,3,0.3818,Positive
Apple and Google may be forced to change app stores in UK,apple google may force change app store uk,Franco1875,55,30,2025-10-22 14:02:12,https://www.reddit.com/r/technology/comments/1od94tk/apple_and_google_may_be_forced_to_change_app/,4,-0.4588,Negative
The Wayback Machine’s Snapshotting Operations Are Undergoing a ‘Breakdown’ | It's unclear what's causing the coverage shortage.,wayback machine snapshotte operation undergo breakdown unclear what s cause coverage shortage,chrisdh79,100,3,2025-10-22 10:52:08,https://www.reddit.com/r/technology/comments/1od4z54/the_wayback_machines_snapshotting_operations_are/,0,-0.4588,Negative
"TSMC produces first Nvidia Blackwell GPU in the US, but it still has to fly to Taiwan for packaging | Advanced CoWoS packaging for GPU dies and HBM3E stacks remains Taiwan-only",tsmc produce first nvidia blackwell gpu we still fly taiwan package advanced cowos packaging gpu die hbme stack remain taiwanonly,chrisdh79,51,14,2025-10-22 14:01:32,https://www.reddit.com/r/technology/comments/1od9467/tsmc_produces_first_nvidia_blackwell_gpu_in_the/,2,0.3612,Positive
"DHS Asks OpenAI to Unmask User Behind ChatGPT Prompts, Possibly the First Such Case",dhs ask openai unmask user behind chatgpt prompt possibly first case,CantStopPoppin,1960,133,2025-10-21 17:57:13,https://www.reddit.com/r/technology/comments/1ocjz3o/dhs_asks_openai_to_unmask_user_behind_chatgpt/,3,0.0,Neutral
Disney+ and Hulu Subscription Cancellations Doubled After Jimmy Kimmel Suspension | Social media users had called for a boycott.,disney hulu subscription cancellation double jimmy kimmel suspension social medium user call boycott,chrisdh79,6809,231,2025-10-21 11:11:46,https://www.reddit.com/r/technology/comments/1oca33n/disney_and_hulu_subscription_cancellations/,2,-0.3182,Negative
HBO Max Raises Prices Across All Plans Effective Immediately,hbo max raise price across plan effective immediately,chrisdh79,3756,731,2025-10-21 13:52:01,https://www.reddit.com/r/technology/comments/1ocdjtm/hbo_max_raises_prices_across_all_plans_effective/,0,0.4767,Positive
Microsoft's Mico is a 'Clippy' for the AI era,microsofts mico clippy ai era,McFatty7,0,4,2025-10-23 22:25:14,https://www.reddit.com/r/technology/comments/1oeh410/microsofts_mico_is_a_clippy_for_the_ai_era/,2,0.0,Neutral
A Tool That Crushes Creativity: AI slop is winning.,tool crush creativity ai slop win,rezwenn,597,197,2025-10-21 23:06:57,https://www.reddit.com/r/technology/comments/1ocs1jq/a_tool_that_crushes_creativity_ai_slop_is_winning/,3,0.4767,Positive
Uber will pay drivers to complete AI jobs while waiting for their next passenger,uber pay driver complete ai job wait next passenger,tylerthe-theatre,1753,118,2025-10-21 17:15:46,https://www.reddit.com/r/technology/comments/1ociuyb/uber_will_pay_drivers_to_complete_ai_jobs_while/,0,-0.1725,Negative
"Vodafone is building a new Black Sea cable to link Europe and Asia while bypassing Russia | The €100 million undersea cable will stretch from Bulgaria to Ukraine, Georgia, and Turkey",vodafone build new black sea cable link europe asia bypass russia million undersea cable stretch bulgaria ukraine georgia turkey,chrisdh79,68,8,2025-10-22 10:44:50,https://www.reddit.com/r/technology/comments/1od4uj6/vodafone_is_building_a_new_black_sea_cable_to/,1,0.0,Neutral
DeepSeek’s Push Into Africa Reveals China’s AI Power Grab,deepseeks push africa reveal chinas ai power grab,defenestrate_urself,0,2,2025-10-23 13:06:09,https://www.reddit.com/r/technology/comments/1oe2ri0/deepseeks_push_into_africa_reveals_chinas_ai/,4,0.0,Neutral
OceanGate's ‘Titan’ went on 7 dives with a damaged hull before implosion,oceangates titan go dive damaged hull implosion,DonkeyFuel,5372,225,2025-10-21 10:23:23,https://www.reddit.com/r/technology/comments/1oc98eo/oceangates_titan_went_on_7_dives_with_a_damaged/,4,-0.4404,Negative
"ISP tricked customers about fiber optics being used in their internet service, German court rules — 'full fiber' customers found to have 'last mile' copper connections | It is technically fiber optic, but the connection between the home and the distribution box still relies on copper cables.",isp trick customer fiber optic use internet service german court rule full fiber customer find last mile copper connection technically fiber optic connection home distribution box still rely copper cable,ControlCAD,679,81,2025-10-21 20:52:57,https://www.reddit.com/r/technology/comments/1ocopsp/isp_tricked_customers_about_fiber_optics_being/,3,-0.0772,Negative
"Exclusive: US considering curbs on exports to China made with US software, sources say",exclusive we consider curb export china make we software source say,joe4942,19,2,2025-10-22 16:46:13,https://www.reddit.com/r/technology/comments/1oddjhj/exclusive_us_considering_curbs_on_exports_to/,1,0.128,Positive
Boris Johnson admits writing books using ChatGPT. Former prime minister said ChatGPT was “frankly fantastic” and AI would help society “because we’re all simple.”,boris johnson admit write book use chatgpt former prime minister say chatgpt frankly fantastic ai would help society simple,esporx,717,160,2025-10-21 20:03:05,https://www.reddit.com/r/technology/comments/1ocne59/boris_johnson_admits_writing_books_using_chatgpt/,2,0.5994,Positive
Here are Amazon’s smart delivery glasses that guide drivers and scan packages,amazon smart delivery glass guide driver scan package,Knightbear49,6,4,2025-10-22 22:55:06,https://www.reddit.com/r/technology/comments/1odn61h/here_are_amazons_smart_delivery_glasses_that/,0,0.4019,Positive
Bari Weiss Gets To Work ‘Fixing’ CBS ‘Bias’ — By Making It More Biased,bari weiss get work fix cbs bias make bias,chrisdh79,2513,139,2025-10-21 12:45:01,https://www.reddit.com/r/technology/comments/1ocbybg/bari_weiss_gets_to_work_fixing_cbs_bias_by_making/,3,-0.3384,Negative
Scientists build artificial neurons that work like real ones,scientist build artificial neuron work like real one,Existing_Tomorrow687,92,16,2025-10-22 06:31:37,https://www.reddit.com/r/technology/comments/1od0u5t/scientists_build_artificial_neurons_that_work/,1,0.3612,Positive
Airbnb picks Alibaba's Qwen over ChatGPT in a win for Chinese open-source AI,airbnb picks alibabas qwen chatgpt win chinese opensource ai,defenestrate_urself,31,5,2025-10-22 12:32:56,https://www.reddit.com/r/technology/comments/1od6ziu/airbnb_picks_alibabas_qwen_over_chatgpt_in_a_win/,2,0.5859,Positive
"AI Data Centers, Desperate for Electricity, Are Building Their Own Power Plants",ai datum center desperate electricity building power plant,postalex,18,2,2025-10-22 14:38:02,https://www.reddit.com/r/technology/comments/1oda255/ai_data_centers_desperate_for_electricity_are/,0,-0.3182,Negative
Kenny Loggins Demands Removal of ‘Danger Zone’ From AI Clip of President Dumping Poop on Protesters,kenny loggin demand removal danger zone ai clip president dump poop protester,rezwenn,13363,186,2025-10-21 03:53:58,https://www.reddit.com/r/technology/comments/1oc2wil/kenny_loggins_demands_removal_of_danger_zone_from/,0,-0.4939,Negative
"Meet Mico, Microsoft’s AI version of Clippy",meet mico microsoft ai version clippy,Sirisian,0,14,2025-10-23 16:42:16,https://www.reddit.com/r/technology/comments/1oe8a6l/meet_mico_microsofts_ai_version_of_clippy/,3,0.0,Neutral
Xbox Is Suffering for the Dumbest Reason Possible,xbox suffer dumb reason possible,dapperlemon,0,6,2025-10-23 20:55:27,https://www.reddit.com/r/technology/comments/1oeey12/xbox_is_suffering_for_the_dumbest_reason_possible/,1,-0.7506,Negative
"After Years of Delays, Jeep Says It Will Finally Start Selling the Rugged Recon EV Next Spring",year delay jeep say finally start sell rugged recon ev next spring,TripleShotPls,8,10,2025-10-22 18:09:45,https://www.reddit.com/r/technology/comments/1odfunz/after_years_of_delays_jeep_says_it_will_finally/,0,0.0,Neutral
China’s chipmakers are cleverly innovating around America’s limits,chinas chipmakers cleverly innovate around america limit,rezwenn,13,1,2025-10-22 15:21:08,https://www.reddit.com/r/technology/comments/1odb7rt/chinas_chipmakers_are_cleverly_innovating_around/,0,0.5106,Positive
"Microsoft prepares major Windows 11 feature drop with new Start menu, Taskbar updates, and more | New features expected to roll out next month",microsoft prepare major window feature drop new start menu taskbar update new feature expect roll next month,hunterd189,0,45,2025-10-23 14:55:07,https://www.reddit.com/r/technology/comments/1oe5gax/microsoft_prepares_major_windows_11_feature_drop/,2,-0.2732,Negative
"Leaked Amazon Plans Say Robots Will Help It Avoid Hiring 600,000 Workers",leak amazon plan say robot help avoid hire worker,Conscious-Quarter423,780,136,2025-10-21 16:56:08,https://www.reddit.com/r/technology/comments/1ocicc3/leaked_amazon_plans_say_robots_will_help_it_avoid/,3,-0.0258,Neutral
Car Repairs Are About To Get Much More Expensive Thanks to Tariffs,car repair get much expensive thank tariff,TripleShotPls,1170,88,2025-10-21 14:40:39,https://www.reddit.com/r/technology/comments/1oces37/car_repairs_are_about_to_get_much_more_expensive/,0,0.4902,Positive
It's Official: Xbox Has a Full-Blown Identity Crisis,official xbox fullblown identity crisis,dapperlemon,5809,590,2025-10-21 06:11:17,https://www.reddit.com/r/technology/comments/1oc5axl/its_official_xbox_has_a_fullblown_identity_crisis/,4,-0.6249,Negative
"Samsung’s Galaxy XR Mixed Reality Headset Undercuts Apple’s Vision Pro by $1,700",samsung galaxy xr mix reality headset undercut apple vision pro,DarthBuzzard,16,15,2025-10-22 13:21:03,https://www.reddit.com/r/technology/comments/1od83vl/samsungs_galaxy_xr_mixed_reality_headset/,2,0.25,Positive
Netflix blames $600m tax dispute with Brazil for disappointing earnings,netflix blame tax dispute brazil disappointing earning,DontFearTheCreaper,108,12,2025-10-22 02:50:42,https://www.reddit.com/r/technology/comments/1ocwu7c/netflix_blames_600m_tax_dispute_with_brazil_for/,1,-0.8225,Negative
The security threats that reveal how the Louvre heist was pulled off,security threat reveal louvre heist pull,FervidBug42,10,0,2025-10-22 15:20:20,https://www.reddit.com/r/technology/comments/1odb702/the_security_threats_that_reveal_how_the_louvre/,3,-0.1027,Negative
'Radical Simplification': GM's Nvidia-Based Computing Platform Aims To Get On Tesla's Level,radical simplification gms nvidiabase compute platform aim get tesla level,TripleShotPls,5,0,2025-10-22 18:06:07,https://www.reddit.com/r/technology/comments/1odfr4u/radical_simplification_gms_nvidiabased_computing/,1,0.0,Neutral
One startup’s quest to store electricity in the ocean,one startup quest store electricity ocean,Logical_Welder3467,14,3,2025-10-22 12:46:23,https://www.reddit.com/r/technology/comments/1od7ah8/one_startups_quest_to_store_electricity_in_the/,4,0.0,Neutral
"Amazon hopes to replace 600,000 US workers with robots, according to leaked documents",amazon hope replace we worker robot accord leak document,MarvelsGrantMan136,1278,216,2025-10-21 11:17:58,https://www.reddit.com/r/technology/comments/1oca72p/amazon_hopes_to_replace_600000_us_workers_with/,1,0.296,Positive
"Remedy CEO steps down, two weeks after it issued a profit warning due to FBC: Firebreak’s “weak sales” | Remedy Entertainment has announced that CEO Tero Virtala has left his role “with immediate effect”",remedy ceo step two week issue profit warning due fbc firebreak weak sale remedy entertainment announce ceo tero virtala leave role immediate effect,ControlCAD,1,10,2025-10-22 18:39:03,https://www.reddit.com/r/technology/comments/1odgn42/remedy_ceo_steps_down_two_weeks_after_it_issued_a/,0,0.5106,Positive
"Catholic church calls for a global AI regulatory framework as Pope Leo XIV pontificates against the technology arms race, calling for the 'audacity of disarmament' | Wants AI to create a ""more authentically just and human global society"", but not impressed with what he's seen so far.",catholic church call global ai regulatory framework pope leo xiv pontificates technology arm race call audacity disarmament want ai create authentically human global society impress he s see far,ControlCAD,2439,163,2025-10-21 05:17:13,https://www.reddit.com/r/technology/comments/1oc4edt/catholic_church_calls_for_a_global_ai_regulatory/,0,-0.4178,Negative
Three wrongly accused over child abuse images after BT gets 'wires crossed',three wrongly accuse child abuse image bt get wire cross,kwentongskyblue,256,18,2025-10-21 17:12:07,https://www.reddit.com/r/technology/comments/1ociri1/three_wrongly_accused_over_child_abuse_images/,3,-0.7506,Negative
Warner Bros. Discovery puts itself up for sale,warner bros discovery put sale,Capable_Salt_SD,515,112,2025-10-21 13:18:43,https://www.reddit.com/r/technology/comments/1occqh7/warner_bros_discovery_puts_itself_up_for_sale/,2,0.0,Neutral
Novo Nordisk chair and directors quit after boardroom rift,novo nordisk chair director quit boardroom rift,esporx,48,3,2025-10-22 02:23:05,https://www.reddit.com/r/technology/comments/1ocw9zp/novo_nordisk_chair_and_directors_quit_after/,3,0.0,Neutral
"GM plans to launch eyes-off driving, Google AI and other new in-vehicle tech by 2028",gm plan launch eyesoff drive google ai new invehicle tech,Puginator,4,2,2025-10-22 15:06:37,https://www.reddit.com/r/technology/comments/1odau0i/gm_plans_to_launch_eyesoff_driving_google_ai_and/,4,0.0,Neutral
News Outlets Won't Describe the President’s AI Video For What It Is: The President Pooping on America,news outlet will not describe president ai video president poope america,chrisdh79,41971,1134,2025-10-20 17:31:37,https://www.reddit.com/r/technology/comments/1obobwg/news_outlets_wont_describe_the_presidents_ai/,4,0.0,Neutral
"GM Says Super Cruise Has 500,000+ Users—And Zero Crashes",gm say super cruise usersand zero crash,TripleShotPls,249,100,2025-10-21 15:44:14,https://www.reddit.com/r/technology/comments/1ocgfm1/gm_says_super_cruise_has_500000_usersand_zero/,0,0.5994,Positive
"China claims NSA hacked its national timing systems using 42 ""special cyber weapons""",china claim nsa hack national timing system use special cyber weapon,chrisdh79,474,85,2025-10-21 12:03:35,https://www.reddit.com/r/technology/comments/1ocb2he/china_claims_nsa_hacked_its_national_timing/,2,-0.4404,Negative
US data center capacity leasing in Q3 exceeds entirety of 2024,us data center capacity lease q exceed entirety,thinkB4WeSpeak,9,1,2025-10-22 10:06:51,https://www.reddit.com/r/technology/comments/1od478t/us_data_center_capacity_leasing_in_q3_exceeds/,4,0.0,Neutral
Sharepoint ToolShell attacks targeted orgs across four continents,sharepoint toolshell attack target org across four continent,lurker_bee,0,1,2025-10-22 21:23:14,https://www.reddit.com/r/technology/comments/1odkz9b/sharepoint_toolshell_attacks_targeted_orgs_across/,0,-0.4404,Negative
Fedora Will Allow AI-Assisted Contributions With Proper Disclosure &amp; Transparency,fedora allow aiassiste contribution proper disclosure amp transparency,moeka_8962,0,1,2025-10-23 03:20:42,https://www.reddit.com/r/technology/comments/1odsr23/fedora_will_allow_aiassisted_contributions_with/,0,0.2263,Positive
"Google porting all internal workloads to Arm, with help from GenAI",google port internal workload arm help genai,Logical_Welder3467,4,1,2025-10-22 11:11:22,https://www.reddit.com/r/technology/comments/1od5bp9/google_porting_all_internal_workloads_to_arm_with/,3,0.4019,Positive
"Google pulls the plug on Privacy Sandbox, leaving cookies in place",google pulls plug privacy sandbox leave cookie place,AdSpecialist6598,5,2,2025-10-22 12:49:50,https://www.reddit.com/r/technology/comments/1od7dd9/google_pulls_the_plug_on_privacy_sandbox_leaving/,1,0.0,Neutral
