Title,Cleaned_Text,Author,Score,Comments,Created_UTC,URL,Cluster,Sentiment_Score,Sentiment
"Jeff Bezos Says He Doesn't Understand Why Anybody Alive Now Would Be 'Discouraged'—Because Soon, 'Millions Of People Will Be Living In Space'",jeff bezos say do not understand anybody alive would discouragedbecause soon million people live space,LetsGoHawks,13909,4179,2025-10-24 21:38:48,https://www.reddit.com/r/technology/comments/1ofa8gx/jeff_bezos_says_he_doesnt_understand_why_anybody/,3,0.3818,Positive
Forensics’ “Holy Grail”: New Test Recovers Fingerprints From Ammunition Casing,forensics holy grail new test recover fingerprint ammunition casing,ourlifeintoronto,438,50,2025-10-25 13:52:59,https://www.reddit.com/r/technology/comments/1ofs3na/forensics_holy_grail_new_test_recovers/,0,0.0,Neutral
Bill Gates warns AI will take over most jobs and leave humans working just two days a week,bill gates warn ai take job leave human work two day week,TheExpressUS,22931,4788,2025-10-24 19:04:10,https://www.reddit.com/r/technology/comments/1of6epw/bill_gates_warns_ai_will_take_over_most_jobs_and/,1,-0.2177,Negative
Cyber exec with lavish lifestyle charged with selling secrets to Russia,cyber exec lavish lifestyle charge sell secret russia,ourlifeintoronto,392,7,2025-10-25 13:47:51,https://www.reddit.com/r/technology/comments/1ofrzfj/cyber_exec_with_lavish_lifestyle_charged_with/,1,-0.2023,Negative
Transparent UV light sensor warns users before skin damage hits,transparent uv light sensor warn user skin damage hit,chrisdh79,56,9,2025-10-26 00:06:42,https://www.reddit.com/r/technology/comments/1og6m9l/transparent_uv_light_sensor_warns_users_before/,2,-0.5574,Negative
"Surprising no one, researchers confirm that AI chatbots are incredibly sycophantic | A study confirms they endorse a user’s actions 50 percent more often than humans do.",surprising one researcher confirm ai chatbot incredibly sycophantic study confirm endorse user action percent often human,MetaKnowing,380,45,2025-10-25 11:00:17,https://www.reddit.com/r/technology/comments/1ofopuk/surprising_no_one_researchers_confirm_that_ai/,1,0.296,Positive
Teen Swarmed by Cops After AI Metal Detector Flags His Doritos Bag as a Gun | AI has done it again.,teen swarm cop ai metal detector flag doritos bag gun ai do,chrisdh79,16158,522,2025-10-24 13:13:23,https://www.reddit.com/r/technology/comments/1oexeoo/teen_swarmed_by_cops_after_ai_metal_detector/,1,-0.34,Negative
Tesla’s “Mad Max” mode is now under federal scrutiny | The new mode added in the latest update will speed and weave through traffic.,teslas mad max mode federal scrutiny new mode add late update speed weave traffic,ControlCAD,3335,296,2025-10-24 19:19:21,https://www.reddit.com/r/technology/comments/1of6sjw/teslas_mad_max_mode_is_now_under_federal_scrutiny/,3,0.0,Neutral
Microsoft Teams is about to become a lapdog for your boss — automatically snitching on your live location when connected to the office wi-fi,microsoft team become lapdog boss automatically snitch live location connect office wifi,hunterd189,7014,578,2025-10-24 15:31:36,https://www.reddit.com/r/technology/comments/1of0vy6/microsoft_teams_is_about_to_become_a_lapdog_for/,1,0.0,Neutral
"China’s Noetix debuts ‘family-friendly’ US$1,400 humanoid robot",china noetix debut familyfriendly we humanoid robot,MetaKnowing,151,54,2025-10-25 11:09:10,https://www.reddit.com/r/technology/comments/1ofovd0/chinas_noetix_debuts_familyfriendly_us1400/,0,0.0,Neutral
Fossil fuel companies say they support the energy transition. New numbers suggest otherwise.,fossil fuel company say support energy transition new number suggest otherwise,Wagamaga,111,10,2025-10-25 12:35:07,https://www.reddit.com/r/technology/comments/1ofqf1l/fossil_fuel_companies_say_they_support_the_energy/,3,0.5859,Positive
"DHS Posts Video Featuring Song Popular With Nazi Creators | The agency denied making ""Nazi propaganda"" in a statement that could be characterized as ""very online.""",dhs post video feature song popular nazi creator agency deny make nazi propaganda statement could characterize online,chrisdh79,9774,607,2025-10-24 11:16:36,https://www.reddit.com/r/technology/comments/1oeuyyu/dhs_posts_video_featuring_song_popular_with_nazi/,2,-0.2732,Negative
Tech billionaires are now shaping the militarization of American cities | Money means access to power—and tech has plenty of money.,tech billionaire shape militarization american city money mean access powerand tech plenty money,chrisdh79,1134,50,2025-10-24 21:48:03,https://www.reddit.com/r/technology/comments/1ofag5n/tech_billionaires_are_now_shaping_the/,3,0.0,Neutral
"Guillermo del Toro compares Frankenstein to a careless ""tech bro,"" says he would ""rather die"" than use generative AI: ""My concern is not artificial intelligence, but natural stupidity""",guillermo del toro compare frankenstein careless tech bro say would rather die use generative ai concern artificial intelligence natural stupidity,ControlCAD,10226,218,2025-10-24 08:59:43,https://www.reddit.com/r/technology/comments/1oesq8x/guillermo_del_toro_compares_frankenstein_to_a/,4,-0.6785,Negative
We analyzed 200 cancer and autism videos on TikTok and found the majority contain misinformation | CBC News,analyze cancer autism video tiktok find majority contain misinformation cbc news,RioMovieFan11,958,70,2025-10-24 20:35:30,https://www.reddit.com/r/technology/comments/1of8pgb/we_analyzed_200_cancer_and_autism_videos_on/,4,-0.7717,Negative
Nuclear treaties offer a blueprint for how to handle AI | The lack of co-ordinated efforts to address the existential risk of superintelligence is astonishing and must change,nuclear treaty offer blueprint handle ai lack coordinate effort address existential risk superintelligence astonishing must change,MetaKnowing,60,10,2025-10-25 11:07:06,https://www.reddit.com/r/technology/comments/1ofou5l/nuclear_treaties_offer_a_blueprint_for_how_to/,1,-0.5267,Negative
AI Dataset for Detecting Nudity Contained Child Sexual Abuse Images,ai dataset detect nudity contain child sexual abuse image,FervidBug42,768,65,2025-10-24 21:06:07,https://www.reddit.com/r/technology/comments/1of9g5d/ai_dataset_for_detecting_nudity_contained_child/,1,-0.6369,Negative
OpenAI is reportedly working on an AI music-generation tool,openai reportedly work ai musicgeneration tool,dapperlemon,0,34,2025-10-26 22:08:29,https://www.reddit.com/r/technology/comments/1ogxgmi/openai_is_reportedly_working_on_an_ai/,1,0.0,Neutral
Microsoft’s Mico heightens the risks of parasocial LLM relationships | “It looks like you’re trying to find a friend. Would you like help?”,microsoft mico heighten risk parasocial llm relationship look like you re try find friend would like help,MetaKnowing,31,14,2025-10-25 10:59:28,https://www.reddit.com/r/technology/comments/1ofopbn/microsofts_mico_heightens_the_risks_of_parasocial/,2,0.7269,Positive
"As aluminum supply becomes constrained, Ford has decided to shelve production of the F-150 Lightning EV",aluminum supply become constrained ford decide shelve production f lightning ev,NebulousNitrate,932,130,2025-10-24 15:57:04,https://www.reddit.com/r/technology/comments/1of1jiu/as_aluminum_supply_becomes_constrained_ford_has/,3,-0.1027,Negative
"Hundreds of public figures, including Apple co-founder Steve Wozniak and Virgin's Richard Branson urge AI ‘superintelligence’ ban",hundred public figure include apple cofounder steve wozniak virgins richard branson urge ai superintelligence ban,PhorosK,1623,102,2025-10-24 12:08:33,https://www.reddit.com/r/technology/comments/1oevz81/hundreds_of_public_figures_including_apple/,0,-0.5574,Negative
"US and China reach ‘final deal’ on TikTok sale, treasury secretary says",us china reach final deal tiktok sale treasury secretary say,TheHeatIsHeated,0,1,2025-10-26 17:06:52,https://www.reddit.com/r/technology/comments/1ogpxqp/us_and_china_reach_final_deal_on_tiktok_sale/,2,0.2263,Positive
"Intel has cut 35,500 jobs in less than two years — more than 20,000 let go in in recent months as Lip-Bu Tan continues drastic recovery journey",intel cut job less two year let go recent month lipbu tan continue drastic recovery journey,ControlCAD,973,91,2025-10-24 14:08:31,https://www.reddit.com/r/technology/comments/1oeyqc0/intel_has_cut_35500_jobs_in_less_than_two_years/,4,-0.2732,Negative
Factory Fire Leaves Ford Without Enough Aluminum to Build the F-150 Lightning,factory fire leave ford without enough aluminum build f lightning,DonkeyFuel,767,90,2025-10-24 14:52:50,https://www.reddit.com/r/technology/comments/1oezv2s/factory_fire_leaves_ford_without_enough_aluminum/,2,-0.34,Negative
"Meta and TikTok breach EU online platform rules, European Commission finds | Both platforms have now time to reply to the findings or face a penalty of up to 6% of their global annual turnover.",meta tiktok breach eu online platform rule european commission find platform time reply finding face penalty global annual turnover,ControlCAD,126,5,2025-10-25 00:22:56,https://www.reddit.com/r/technology/comments/1ofdsmg/meta_and_tiktok_breach_eu_online_platform_rules/,2,-0.4588,Negative
a16z-Backed Startup Sells Thousands of ‘Synthetic Influencers’ to Manipulate Social Media as a Service | Andreessen Horowitz is funding a company that clearly violates the inauthentic behavior policies of every major social media platform,azbacke startup sell thousand synthetic influencer manipulate social medium service andreessen horowitz funding company clearly violate inauthentic behavior policy every major social medium platform,Hrmbee,367,28,2025-10-24 18:24:55,https://www.reddit.com/r/technology/comments/1of5eau/a16zbacked_startup_sells_thousands_of_synthetic/,2,-0.1531,Negative
Building Digital Sovereignty: What Does Europe Need and How to Achieve It,build digital sovereignty europe need achieve,testus_maximus,8,4,2025-10-25 13:43:07,https://www.reddit.com/r/technology/comments/1ofrvqp/building_digital_sovereignty_what_does_europe/,4,0.0,Neutral
mRNA COVID vaccine during cancer therapy linked to 2x survival rate,mrna covid vaccine cancer therapy link x survival rate,chrisdh79,997,22,2025-10-24 11:39:06,https://www.reddit.com/r/technology/comments/1oevdzv/mrna_covid_vaccine_during_cancer_therapy_linked/,0,-0.6597,Negative
"Nvidia expands in southern Israel, tripling Be'er Sheva footprint and hiring hundreds",nvidia expand southern israel triple beer sheva footprint hire hundred,NotSoSaneExile,0,20,2025-10-26 13:47:20,https://www.reddit.com/r/technology/comments/1ogl1qt/nvidia_expands_in_southern_israel_tripling_beer/,2,0.1027,Positive
"Microsoft wants Xbox to hit 30% margins, explaining price hikes and layoffs",microsoft want xbox hit margin explain price hike layoff,AdSpecialist6598,585,269,2025-10-24 13:11:43,https://www.reddit.com/r/technology/comments/1oexdbi/microsoft_wants_xbox_to_hit_30_margins_explaining/,3,0.0,Neutral
Politics bubbles created by TikTok's algorithm primarily benefit the PVV,politic bubble create tiktok algorithm primarily benefit pvv,Wagamaga,148,20,2025-10-24 20:39:43,https://www.reddit.com/r/technology/comments/1of8t0y/politics_bubbles_created_by_tiktoks_algorithm/,3,0.6124,Positive
"MAGA Website Took Money to Unmask Charlie Critics—Then Vanished | The right-wing “exposure” project took donations and then disappeared, infuriating donors.",maga website take money unmask charlie criticsthen vanish rightwe exposure project take donation disappear infuriate donor,Aggravating_Money992,50101,2634,2025-10-23 17:07:34,https://www.reddit.com/r/technology/comments/1oe8yb8/maga_website_took_money_to_unmask_charlie/,3,-0.6486,Negative
Ohio lawmaker proposes comprehensive ban on marrying AI systems and granting legal personhood | House Bill 469 would label artificial intelligence as 'nonsentient entities' and block legal personhood,ohio lawmaker propose comprehensive ban marrying ai system grant legal personhood house bill would label artificial intelligence nonsentient entity block legal personhood,MetaKnowing,357,61,2025-10-24 13:39:35,https://www.reddit.com/r/technology/comments/1oey0zo/ohio_lawmaker_proposes_comprehensive_ban_on/,0,0.2263,Positive
Local NBC Station Fooled by AI Video of Race Track Power Outage Causing Huge Crash,local nbc station fool ai video race track power outage cause huge crash,TripleShotPls,148,8,2025-10-24 18:24:27,https://www.reddit.com/r/technology/comments/1of5dv8/local_nbc_station_fooled_by_ai_video_of_race/,0,-0.4588,Negative
"DHS Wants a Fleet of AI-Powered Surveillance Trucks. US border patrol is asking companies to submit plans to turn standard 4x4 trucks into AI-powered watchtowers—combining radar, cameras, and autonomous tracking to extend surveillance on demand.",dhs want fleet aipowere surveillance truck we border patrol ask company submit plan turn standard x truck aipowere watchtowerscombine radar camera autonomous tracking extend surveillance demand,Knightbear49,55,10,2025-10-24 23:10:59,https://www.reddit.com/r/technology/comments/1ofcanf/dhs_wants_a_fleet_of_aipowered_surveillance/,3,0.0516,Positive
Jeep Issues Emergency Recall for OTA-Bricked Wrangler 4xes,jeep issue emergency recall otabricke wrangler xe,DonkeyFuel,244,59,2025-10-24 14:53:07,https://www.reddit.com/r/technology/comments/1oezvbs/jeep_issues_emergency_recall_for_otabricked/,4,-0.3818,Negative
"Money, muscles and anxiety: why the manosphere clicked with young men – a visual deep dive",money muscle anxiety manosphere click young man visual deep dive,GirasoleDE,198,95,2025-10-24 15:00:02,https://www.reddit.com/r/technology/comments/1of01vn/money_muscles_and_anxiety_why_the_manosphere/,1,-0.1779,Negative
Miami Has a New Cop on the Beat: A Drone-Launching Police Car That Can Drive Itself,miami new cop beat dronelaunche police car drive,seeebiscuit,25,13,2025-10-25 01:21:06,https://www.reddit.com/r/technology/comments/1ofeycf/miami_has_a_new_cop_on_the_beat_a_dronelaunching/,2,0.0,Neutral
Big Tech is paying for Trump's White House ballroom,big tech pay trump white house ballroom,TripleShotPls,81,24,2025-10-24 18:27:24,https://www.reddit.com/r/technology/comments/1of5git/big_tech_is_paying_for_trumps_white_house_ballroom/,1,0.0,Neutral
Apple hit with $2 billion payout in record UK class-action ruling | App Store's 30-percent commission fees declared excessive,apple hit billion payout record uk classaction rule app store percent commission fee declare excessive,chrisdh79,299,70,2025-10-24 11:13:36,https://www.reddit.com/r/technology/comments/1oeuwwt/apple_hit_with_2_billion_payout_in_record_uk/,3,0.0,Neutral
US alleges executive sold secrets to Russia for $1.3 million,we allege executive sell secret russia million,MicroSofty88,2166,63,2025-10-23 23:48:40,https://www.reddit.com/r/technology/comments/1oeiyg2/us_alleges_executive_sold_secrets_to_russia_for/,4,0.0,Neutral
BBC probe finds AI chatbots mangle nearly half of news summaries,bbc probe find ai chatbot mangle nearly half news summary,Logical_Welder3467,182,5,2025-10-24 13:13:07,https://www.reddit.com/r/technology/comments/1oexeh5/bbc_probe_finds_ai_chatbots_mangle_nearly_half_of/,2,0.0,Neutral
"Democrats Will Launch a 'Master ICE Tracker' to Monitor Misconduct | ""Oversight Committee will be launching, on their website, a master ICE tracker where we’re gonna be tracking every single instance that we can verify that the community will send us information on,” said Rep. Garcia.",democrats launch master ice tracker monitor misconduct oversight committee launch website master ice tracker go to track every single instance verify community send us information say rep garcia,Aggravating_Money992,15615,258,2025-10-23 13:59:33,https://www.reddit.com/r/technology/comments/1oe40lu/democrats_will_launch_a_master_ice_tracker_to/,0,0.0,Neutral
Microsoft Disables Downloaded File Previews to Block NTLM Hash Leaks,microsoft disable download file preview block ntlm hash leak,Choobeen,17,2,2025-10-25 00:01:39,https://www.reddit.com/r/technology/comments/1ofdcyh/microsoft_disables_downloaded_file_previews_to/,2,-0.4404,Negative
Vermont state senator Samuel Douglass formally resigns following leaked group chat,vermont state senator samuel douglass formally resign follow leak group chat,esporx,3414,121,2025-10-23 18:23:44,https://www.reddit.com/r/technology/comments/1oeaz2r/vermont_state_senator_samuel_douglass_formally/,4,-0.5574,Negative
Valve Just Crashed The High End ‘Counter-Strike’ Skins Market,valve crash high end counterstrike skin market,dilbertron,16890,1281,2025-10-23 11:15:58,https://www.reddit.com/r/technology/comments/1oe0ikn/valve_just_crashed_the_high_end_counterstrike/,1,0.0,Neutral
A single DNS race condition brought Amazon's cloud empire to its knees,single dns race condition bring amazon cloud empire knee,Logical_Welder3467,861,65,2025-10-24 00:24:53,https://www.reddit.com/r/technology/comments/1oejpwl/a_single_dns_race_condition_brought_amazons_cloud/,0,0.0,Neutral
"AWS reveals new cloud incident reporting tool, with almost zero sense of irony",aw reveal new cloud incident reporting tool almost zero sense irony,Franco1875,222,14,2025-10-24 07:38:58,https://www.reddit.com/r/technology/comments/1oerime/aws_reveals_new_cloud_incident_reporting_tool/,2,-0.0516,Negative
"ICE recruitment ads appearing on Spotify, HBO Max and other streaming services",ice recruitment ad appear spotify hbo max streaming service,Conscious-Quarter423,4208,395,2025-10-23 15:30:08,https://www.reddit.com/r/technology/comments/1oe6d8w/ice_recruitment_ads_appearing_on_spotify_hbo_max/,2,0.0,Neutral
Elon Musk defends $1 trillion pay package: ‘I just don’t feel comfortable building a robot army here and then being ousted’,elon musk defend trillion pay package do not feel comfortable building robot army oust,MetaKnowing,67,55,2025-10-24 13:27:57,https://www.reddit.com/r/technology/comments/1oexr5s/elon_musk_defends_1_trillion_pay_package_i_just/,2,0.4404,Positive
OpenAI reportedly developing new generative music tool,openai reportedly develop new generative music tool,Logical_Welder3467,0,19,2025-10-26 00:10:55,https://www.reddit.com/r/technology/comments/1og6pag/openai_reportedly_developing_new_generative_music/,4,0.0,Neutral
"Software is the next battleground in the US-China tech war | President considers curbs on US software exports, China has vowed to retaliate",software next battleground uschina tech war president consider curb us software export china vow retaliate,chrisdh79,83,26,2025-10-24 11:15:16,https://www.reddit.com/r/technology/comments/1oeuy0t/software_is_the_next_battleground_in_the_uschina/,4,-0.765,Negative
Apple begins shipping American-made AI servers from Texas,apple begin ship americanmade ai servers texas,Conscious-Quarter423,31,35,2025-10-24 16:02:45,https://www.reddit.com/r/technology/comments/1of1p43/apple_begins_shipping_americanmade_ai_servers/,2,0.0,Neutral
Trump pardons convicted Binance founder,trump pardon convict binance founder,No-Aardvark-7316,420,41,2025-10-24 01:59:25,https://www.reddit.com/r/technology/comments/1oelm80/trump_pardons_convicted_binance_founder/,4,0.296,Positive
Medusa Ransomware Leaks 834 GB of Comcast Data After $1.2M Demand,medusa ransomware leak gb comcast datum demand,lurker_bee,344,13,2025-10-24 02:37:03,https://www.reddit.com/r/technology/comments/1oemdez/medusa_ransomware_leaks_834_gb_of_comcast_data/,2,-0.128,Negative
"Letitia James launches portal for New Yorkers to submit photos, videos of ICE",letitia james launch portal new yorker submit photo video ice,esporx,14417,213,2025-10-23 07:45:18,https://www.reddit.com/r/technology/comments/1odx5wh/letitia_james_launches_portal_for_new_yorkers_to/,1,0.0,Neutral
"A $60 Mod to Meta’s Ray-Bans Disables Its Privacy-Protecting Recording Light | Meta’s Ray-Ban glasses usually include an LED that lights up when the user is recording other people. One hobbyist is charging a small fee to disable that light, and has a growing list of customers around the country.",mod metas rayban disable privacyprotecte record light metas rayban glass usually include lead light user record people one hobbyist charge small fee disable light grow list customer around country,chrisdh79,3763,636,2025-10-23 13:06:40,https://www.reddit.com/r/technology/comments/1oe2ry0/a_60_mod_to_metas_raybans_disables_its/,4,0.1779,Positive
"GM will ditch Apple CarPlay and Android Auto on all its cars, not just EVs",gm ditch apple carplay android auto car evs,TripleShotPls,6210,1715,2025-10-23 10:28:18,https://www.reddit.com/r/technology/comments/1odzp60/gm_will_ditch_apple_carplay_and_android_auto_on/,4,0.0,Neutral
Largest study of its kind shows AI assistants misrepresent news content 45% of the time – regardless of language or territory,large study kind show ai assistant misrepresent news content time regardless language territory,Bob_Spud,809,36,2025-10-23 20:38:26,https://www.reddit.com/r/technology/comments/1oeehof/largest_study_of_its_kind_shows_ai_assistants/,0,0.5267,Positive
Brazil’s Pix payment system reshapes how millions pay — and puts Washington on edge,brazils pix payment system reshape millions pay put washington edge,Hrmbee,776,158,2025-10-23 19:55:57,https://www.reddit.com/r/technology/comments/1oeddf0/brazils_pix_payment_system_reshapes_how_millions/,1,-0.1027,Negative
How Prankster Oobah Butler Convinced Venture Capitalists to Give Him Over $1 Million,prankster oobah butler convince venture capitalist give million,TripleShotPls,22,0,2025-10-24 15:04:37,https://www.reddit.com/r/technology/comments/1of06ft/how_prankster_oobah_butler_convinced_venture/,4,0.4019,Positive
Will AI lengthen lifespans or shorten them?,ai lengthen lifespans shorten,rezwenn,0,12,2025-10-25 21:48:28,https://www.reddit.com/r/technology/comments/1og3ndn/will_ai_lengthen_lifespans_or_shorten_them/,0,0.0,Neutral
Rivian will pay $250M to settle lawsuit over R1 price hike,rivian pay settle lawsuit r price hike,TripleShotPls,20,1,2025-10-24 15:06:46,https://www.reddit.com/r/technology/comments/1of08ig/rivian_will_pay_250m_to_settle_lawsuit_over_r1/,1,-0.3182,Negative
Big tech bankrolling Trump's East Wing destruction,big tech bankrolling trump east wing destruction,motherjonesmag,21,6,2025-10-24 14:48:13,https://www.reddit.com/r/technology/comments/1oezqsa/big_tech_bankrolling_trumps_east_wing_destruction/,0,-0.5719,Negative
"Two federal judges acknowledged their staff's use of artificial intelligence in preparing recent court orders, which were subsequently found to be riddled with errors",two federal judge acknowledge staff use artificial intelligence prepare recent court order subsequently find riddled error,nohup_me,1008,18,2025-10-23 17:44:33,https://www.reddit.com/r/technology/comments/1oe9xr9/two_federal_judges_acknowledged_their_staffs_use/,4,0.1779,Positive
Reports suggest Apple is already pulling back on the iPhone Air,report suggest apple already pull back iphone air,Ninja-kakashi16,0,33,2025-10-25 14:00:09,https://www.reddit.com/r/technology/comments/1ofs9jg/reports_suggest_apple_is_already_pulling_back_on/,3,0.0,Neutral
"This browser claims “perfect privacies protection,” but it acts like malware",browser claim perfect privacy protection act like malware,ope_poe,14,3,2025-10-24 15:30:05,https://www.reddit.com/r/technology/comments/1of0ugw/this_browser_claims_perfect_privacies_protection/,0,0.5023,Positive
MAGA’s Group-Chat Problem,magas groupchat problem,rezwenn,2806,97,2025-10-23 10:31:22,https://www.reddit.com/r/technology/comments/1odzr1n/magas_groupchat_problem/,1,-0.4019,Negative
Former L3Harris cyber director charged with selling secrets,former lharris cyber director charge sell secret,pyeri,50,4,2025-10-24 07:31:13,https://www.reddit.com/r/technology/comments/1oerepe/former_l3harris_cyber_director_charged_with/,3,-0.2023,Negative
A Fake Debate in Virginia Raises Real Questions About AI in Politics,fake debate virginia raise real question ai politic,Generalaverage89,18,0,2025-10-24 12:29:58,https://www.reddit.com/r/technology/comments/1oewfbc/a_fake_debate_in_virginia_raises_real_questions/,0,-0.4767,Negative
Female spies are waging ‘sex warfare’ to steal Silicon Valley secrets | China and Russia are sending attractive women to seduce tech workers - even marrying and having children with their targets,female spy wage sex warfare steal silicon valley secrets china russia send attractive woman seduce tech worker even marry child target,digital-didgeridoo,17574,1512,2025-10-23 01:18:23,https://www.reddit.com/r/technology/comments/1odq9z6/female_spies_are_waging_sex_warfare_to_steal/,3,-0.0772,Negative
NPR/WBUR: The world has its first AI government official,nprwbur world first ai government official,SnoozeDoggyDog,22,5,2025-10-24 10:44:27,https://www.reddit.com/r/technology/comments/1oeuebo/nprwbur_the_world_has_its_first_ai_government/,0,0.0,Neutral
"An NIH director, Richard Woychik, a molecular geneticist, joins MAHA, gets replaced by JD Vance’s close friend | The NTP produced controversial studies on cellphone radiation and fluoride.",nih director richard woychik molecular geneticist join maha get replace jd vances close friend ntp produce controversial study cellphone radiation fluoride,ControlCAD,139,19,2025-10-24 00:23:38,https://www.reddit.com/r/technology/comments/1oejozd/an_nih_director_richard_woychik_a_molecular/,4,0.34,Positive
"Reddit drags Perplexity in a new lawsuit, accusing it of building up a $20 billion company off stolen data",reddit drag perplexity new lawsuit accuse build billion company steal datum,Choobeen,696,108,2025-10-23 15:28:54,https://www.reddit.com/r/technology/comments/1oe6c1t/reddit_drags_perplexity_in_a_new_lawsuit_accusing/,1,-0.7579,Negative
Amazon ordered to pay $20K after B.C. customer says package never arrived,amazon order pay k bc customer say package never arrive,SwordfishOk504,467,46,2025-10-23 17:36:38,https://www.reddit.com/r/technology/comments/1oe9qb6/amazon_ordered_to_pay_20k_after_bc_customer_says/,3,0.0772,Positive
