Title,Cleaned_Text,Author,Score,Comments,Created_UTC,URL,Cluster,Sentiment_Score,Sentiment
"Texas lawmakers double down on Discovery, call for DOJ investigation into Smithsonian | “This is the dumbest plan I’ve ever heard in nearly five years in the United States Senate.”",texas lawmakers double discovery call doj investigation smithsonian dumb plan I ve ever hear nearly five year united states senate,chrisdh79,1182,110,2025-10-23 12:34:01,https://www.reddit.com/r/technology/comments/1oe2263/texas_lawmakers_double_down_on_discovery_call_for/,2,-0.128,Negative
Treat Big Tech like Big Tobacco,treat big tech like big tobacco,Well_Socialized,252,41,2025-10-23 20:08:05,https://www.reddit.com/r/technology/comments/1oedoyc/treat_big_tech_like_big_tobacco/,4,0.6369,Positive
183 million email accounts just got compromised. Check if you're affected,million email account get compromise check you re affect,Abject-Pick-6472,2010,266,2025-10-23 08:40:21,https://www.reddit.com/r/technology/comments/1odxzpz/183_million_email_accounts_just_got_compromised/,4,-0.1531,Negative
Scientists Use “Supercentenarian Longevity Gene” to Slow Rapid Aging Disease,scientist use supercentenarian longevity gene slow rapid age disease,Existing_Tomorrow687,62,3,2025-10-24 03:29:00,https://www.reddit.com/r/technology/comments/1oene2h/scientists_use_supercentenarian_longevity_gene_to/,0,0.0,Neutral
UK traffic to porn sites falls by a third after new age verification rules,uk traffic porn site fall third new age verification rule,rezwenn,1591,360,2025-10-23 08:55:28,https://www.reddit.com/r/technology/comments/1ody7x2/uk_traffic_to_porn_sites_falls_by_a_third_after/,2,0.0,Neutral
Nexperia's China unit resumes chip sales to domestic distributors,nexperias china unit resume chip sale domestic distributor,tommos,16,10,2025-10-24 09:17:32,https://www.reddit.com/r/technology/comments/1oet007/nexperias_china_unit_resumes_chip_sales_to/,0,0.0,Neutral
Real-Time Audio Deepfakes Are Now a Reality | A cybersecurity firm has created convincing voices on the fly,realtime audio deepfake reality cybersecurity firm create convincing voice fly,MetaKnowing,7,1,2025-10-24 13:37:16,https://www.reddit.com/r/technology/comments/1oexz1f/realtime_audio_deepfakes_are_now_a_reality_a/,2,0.5719,Positive
"The real reason electricity prices are rising, and it’s not data centers",real reason electricity price rise datum center,paxinfernum,0,31,2025-10-25 16:22:47,https://www.reddit.com/r/technology/comments/1ofvpjd/the_real_reason_electricity_prices_are_rising_and/,1,0.0,Neutral
Cancer Patients Receiving Covid mRNA Shots Show Dramatically Longer Survival,cancer patient receive covid mrna shot show dramatically long survival,rezwenn,1201,43,2025-10-23 09:24:50,https://www.reddit.com/r/technology/comments/1odyo80/cancer_patients_receiving_covid_mrna_shots_show/,0,-0.6597,Negative
Detection firm finds 82% of herbal remedy books on Amazon ‘likely written’ by AI,detection firm find herbal remedy book amazon likely write ai,MetaKnowing,451,25,2025-10-23 14:29:05,https://www.reddit.com/r/technology/comments/1oe4rmk/detection_firm_finds_82_of_herbal_remedy_books_on/,1,0.1779,Positive
Some Democrats Are Helping the Trump Admin's Anti-LGBTQ+ Tech Agenda,democrats help trump admin antilgbtq tech agenda,Well_Socialized,151,18,2025-10-23 20:12:20,https://www.reddit.com/r/technology/comments/1oedsxp/some_democrats_are_helping_the_trump_admins/,3,0.296,Positive
"Wi-Fi can accurately identify people, even if they aren't carrying a phone or computer | Device-free identification",wifi accurately identify people even be not carry phone computer devicefree identification,chrisdh79,409,42,2025-10-23 13:54:33,https://www.reddit.com/r/technology/comments/1oe3w74/wifi_can_accurately_identify_people_even_if_they/,0,0.0,Neutral
"AI models may be developing their own ‘survival drive’, researchers say",ai model may develop survival drive researcher say,Wagamaga,0,12,2025-10-25 10:40:12,https://www.reddit.com/r/technology/comments/1ofoec7/ai_models_may_be_developing_their_own_survival/,4,0.0,Neutral
"Silent Hill series producer Motoi Okamoto Claims Silent Hill f's 'Bold Choices' Were A Result of Human Design That AI 'Would Never Be Able to Make' | Producer dismisses Hideo Kojima's claims that ""remakes and sequels will be made by AI"" in the future.",silent hill series producer motoi okamoto claim silent hill fs bold choice result human design ai would never able make producer dismisse hideo kojimas claim remake sequel make ai future,ControlCAD,141,6,2025-10-23 18:27:50,https://www.reddit.com/r/technology/comments/1oeb2wx/silent_hill_series_producer_motoi_okamoto_claims/,1,0.3818,Positive
"Celebrating 1 Trillion Web Pages Archived: ""This October, the Internet Archive will celebrate an extraordinary milestone: 1 trillion web pages preserved and available for access via the Wayback Machine.""",celebrate trillion web page archive october internet archive celebrate extraordinary milestone trillion web page preserve available access via wayback machine,thebrucekim,261,15,2025-10-23 14:14:44,https://www.reddit.com/r/technology/comments/1oe4ekp/celebrating_1_trillion_web_pages_archived_this/,2,0.8126,Positive
Microsoft AI chief says company won’t build chatbots for erotica,microsoft ai chief say company will not build chatbot erotica,Puginator,51,54,2025-10-23 22:43:07,https://www.reddit.com/r/technology/comments/1oehipc/microsoft_ai_chief_says_company_wont_build/,1,0.0,Neutral
"The AWS Outage Bricked People’s $2,700 Smartbeds",aw outage bricke people smartbed,Roku-Hanmar,646,180,2025-10-23 08:54:30,https://www.reddit.com/r/technology/comments/1ody7ey/the_aws_outage_bricked_peoples_2700_smartbeds/,1,0.0,Neutral
"Apple loses UK App Store monopoly case, penalty might near $2 billion - 9to5Mac",apple lose uk app store monopoly case penalty might near billion tomac,XiXMak,121,25,2025-10-23 18:01:56,https://www.reddit.com/r/technology/comments/1oeaefu/apple_loses_uk_app_store_monopoly_case_penalty/,4,-0.6486,Negative
"A single DNS race condition brought Amazon's cloud empire to its knees. Fault in DynamoDB system cascaded through AWS services, knocking major sites offline for hours",single dns race condition bring amazon cloud empire knee fault dynamodb system cascade aw service knock major site offline hour,Silly-avocatoe,166,15,2025-10-23 15:58:10,https://www.reddit.com/r/technology/comments/1oe73uc/a_single_dns_race_condition_brought_amazons_cloud/,4,-0.4939,Negative
Windows Server emergency patches fix WSUS bug with PoC exploit,windows server emergency patch fix wsus bug poc exploit,lurker_bee,1,1,2025-10-24 13:37:32,https://www.reddit.com/r/technology/comments/1oexz9s/windows_server_emergency_patches_fix_wsus_bug/,4,-0.4588,Negative
Tesla profits fall 37% in Q3 despite healthy sales | A loss of regulatory credits and increased expenses didn’t help.,tesla profit fall q despite healthy sale loss regulatory credit increase expense do not help,ControlCAD,2743,190,2025-10-23 00:24:45,https://www.reddit.com/r/technology/comments/1odp5lp/tesla_profits_fall_37_in_q3_despite_healthy_sales/,4,0.8361,Positive
"Mercedes' Axial Flux Motor Weighs Less Than A Toddler And Makes Over 1,000 HP",mercede axial flux motor weigh less toddler make hp,abrownn,97,85,2025-10-23 18:05:23,https://www.reddit.com/r/technology/comments/1oeahtb/mercedes_axial_flux_motor_weighs_less_than_a/,3,0.0,Neutral
I was an AI scribe-skeptical doctor. And then I actually tried it.,ai scribeskeptical doctor actually try,rezwenn,0,18,2025-10-25 13:40:44,https://www.reddit.com/r/technology/comments/1ofrtu9/i_was_an_ai_scribeskeptical_doctor_and_then_i/,3,0.0,Neutral
Meta lays off 600 employees within AI unit,meta lay employee within ai unit,shinbreaker,22801,1544,2025-10-22 15:23:53,https://www.reddit.com/r/technology/comments/1odbajd/meta_lays_off_600_employees_within_ai_unit/,3,0.0,Neutral
"A peer-reviewed study shows that AI-powered social media bots can increase user engagement on posts, but they fall short of encouraging users to post more overall",peerreviewe study show aipowere social medium bot increase user engagement post fall short encourage user post overall,nohup_me,0,2,2025-10-24 17:25:35,https://www.reddit.com/r/technology/comments/1of3uo1/a_peerreviewed_study_shows_that_aipowered_social/,0,0.8047,Positive
Microsoft Pushes Xbox Division to Hit Higher Profit Margins,microsoft pushes xbox division hit high profit margin,rezwenn,54,47,2025-10-23 19:52:12,https://www.reddit.com/r/technology/comments/1oed9u2/microsoft_pushes_xbox_division_to_hit_higher/,4,0.4404,Positive
"Healthcare orgs deploy AI at twice the rate of rest of economy, report finds",healthcare org deploy ai twice rate rest economy report find,rezwenn,86,17,2025-10-23 15:57:43,https://www.reddit.com/r/technology/comments/1oe73fc/healthcare_orgs_deploy_ai_at_twice_the_rate_of/,3,0.0,Neutral
OpenAI Wants to Cure Cancer. So Why Did It Make a Web Browser?,openai want cure cancer make web browser,rezwenn,247,105,2025-10-23 10:23:53,https://www.reddit.com/r/technology/comments/1odzmi2/openai_wants_to_cure_cancer_so_why_did_it_make_a/,3,-0.6597,Negative
"We uploaded a fake video to 8 social apps. Only one told users it wasn’t real. | Facebook, TikTok and other major platforms do not use a tech industry standard touted as a way to flag fake content, tests using AI-generated videos found.",upload fake video social app one tell user be not real facebook tiktok major platform use tech industry standard tout way flag fake content test use aigenerate video find,MetaKnowing,108,6,2025-10-23 14:32:01,https://www.reddit.com/r/technology/comments/1oe4ub2/we_uploaded_a_fake_video_to_8_social_apps_only/,4,-0.7506,Negative
"AI Models Get Brain Rot, Too | A new study shows that feeding large language models low-quality, high-engagement content from social media lowers their cognitive abilities.",ai model get brain rot new study show feed large language model lowquality highengagement content social medium lower cognitive ability,MetaKnowing,112,19,2025-10-23 14:25:31,https://www.reddit.com/r/technology/comments/1oe4oez/ai_models_get_brain_rot_too_a_new_study_shows/,0,0.128,Positive
A Costly Radio System Faltered When Texas Needed It Most,costly radio system falter texas need,rezwenn,38,5,2025-10-23 19:26:47,https://www.reddit.com/r/technology/comments/1oecmmu/a_costly_radio_system_faltered_when_texas_needed/,2,-0.1027,Negative
"Apple is 'drastically' cutting iPhone Air production, report says, after new survey reveals 'virtually no demand' | Fortune",apple drastically cut iphone air production report say new survey reveal virtually demand fortune,Arthur_Morgan44469,2416,622,2025-10-22 20:39:52,https://www.reddit.com/r/technology/comments/1odjv08/apple_is_drastically_cutting_iphone_air/,2,-0.4939,Negative
Section 230 Applies to Scammy Ads-Glazer v. Facebook,section apply scammy adsglazer v facebook,StraightedgexLiberal,15,4,2025-10-23 23:49:14,https://www.reddit.com/r/technology/comments/1oeiyv8/section_230_applies_to_scammy_adsglazer_v_facebook/,4,0.0,Neutral
Eight Sleep adds ‘outage mode’ to smart beds after AWS problems left them frozen,eight sleep add outage mode smart bed aws problem leave frozen,Forward-Answer-4407,3895,345,2025-10-22 16:44:01,https://www.reddit.com/r/technology/comments/1oddh8v/eight_sleep_adds_outage_mode_to_smart_beds_after/,4,0.0,Neutral
PC gamers claim Windows 11's Gaming Copilot is capturing gameplay for AI training by default – but what it's actually doing is spoiling performance,pc gamer claim window gaming copilot capturing gameplay ai training default actually spoil performance,moeka_8962,39,0,2025-10-23 17:19:04,https://www.reddit.com/r/technology/comments/1oe99bf/pc_gamers_claim_windows_11s_gaming_copilot_is/,2,0.0,Neutral
IFPI shuts down Y2mate.com and 11 other major stream ripping sites in landmark action in Vietnam. — IFPI,ifpi shut ymatecom major stream rip site landmark action vietnam ifpi,Smart-Combination-59,0,3,2025-10-24 16:36:50,https://www.reddit.com/r/technology/comments/1of2kyl/ifpi_shuts_down_y2matecom_and_11_other_major/,4,0.0772,Positive
Meta replacing humans with AI for FTC-mandated privacy reviews,meta replace human ai ftcmandate privacy review,joe4942,14,1,2025-10-23 20:39:50,https://www.reddit.com/r/technology/comments/1oeeix9/meta_replacing_humans_with_ai_for_ftcmandated/,3,0.0,Neutral
Waymo Under Federal Investigation for Driving Around Stopped School Bus,waymo federal investigation drive around stop school bus,Forward-Answer-4407,27,5,2025-10-23 18:11:25,https://www.reddit.com/r/technology/comments/1oeankj/waymo_under_federal_investigation_for_driving/,0,-0.2263,Negative
Reddit Accuses ‘Data Scraper’ Companies of Theft,reddit accuse data scraper company theft,SwordfishOk504,28,3,2025-10-23 17:34:09,https://www.reddit.com/r/technology/comments/1oe9nx1/reddit_accuses_data_scraper_companies_of_theft/,3,-0.34,Negative
"Google’s bets on carbon capture power plants, which have a mixed record | TechCrunch",googles bet carbon capture power plant mix record techcrunch,Franco1875,13,2,2025-10-23 21:18:43,https://www.reddit.com/r/technology/comments/1oefizk/googles_bets_on_carbon_capture_power_plants_which/,0,0.0,Neutral
"Renewable energy investment should come from defence budgets, say retired military leaders",renewable energy investment come defence budget say retired military leader,Wagamaga,88,4,2025-10-23 11:09:34,https://www.reddit.com/r/technology/comments/1oe0eg9/renewable_energy_investment_should_come_from/,1,0.3612,Positive
Rivian reportedly cutting 600 workers in third layoff of the year,rivian reportedly cut worker third layoff year,TripleShotPls,39,2,2025-10-23 16:01:18,https://www.reddit.com/r/technology/comments/1oe76vi/rivian_reportedly_cutting_600_workers_in_third/,2,-0.128,Negative
AI bubble inflates Microsoft CEO pay to $96.5M,ai bubble inflate microsoft ceo pay,Logical_Welder3467,5616,342,2025-10-22 12:49:09,https://www.reddit.com/r/technology/comments/1od7ctl/ai_bubble_inflates_microsoft_ceo_pay_to_965m/,4,-0.1027,Negative
Anthropic's Google Cloud deal includes 1 million TPUs and 1 GW of capacity in 2026,anthropic google cloud deal include million tpus gw capacity,Puginator,15,0,2025-10-23 20:36:56,https://www.reddit.com/r/technology/comments/1oeegbl/anthropics_google_cloud_deal_includes_1_million/,2,0.0,Neutral
European giants strike deal on €6B space champion to rival Elon Musk,european giants strike deal b space champion rival elon musk,nohup_me,20,7,2025-10-23 18:32:45,https://www.reddit.com/r/technology/comments/1oeb7hf/european_giants_strike_deal_on_6b_space_champion/,2,0.5267,Positive
"Canada, Ontario Pledge Billions to Build G-7’s First Small Modular Reactors",canada ontario pledge billions build gs first small modular reactor,joe4942,38,5,2025-10-23 14:55:04,https://www.reddit.com/r/technology/comments/1oe5g93/canada_ontario_pledge_billions_to_build_g7s_first/,1,0.0,Neutral
Fed Lost Access to Private Jobs Data Ahead of Government Shutdown. Payroll processing firm ADP ended its data-sharing with the central bank.,fed lose access private job datum ahead government shutdown payroll processing firm adp end datashare central bank,esporx,1143,35,2025-10-22 20:19:37,https://www.reddit.com/r/technology/comments/1odjby7/fed_lost_access_to_private_jobs_data_ahead_of/,1,-0.3182,Negative
Mark Cuban warns that OpenAI’s new plan to allow adults-only erotica in ChatGPT could ‘backfire. Hard’,mark cuban warn openais new plan allow adultsonly erotica chatgpt could backfire hard,MetaKnowing,5347,511,2025-10-22 12:02:31,https://www.reddit.com/r/technology/comments/1od6bru/mark_cuban_warns_that_openais_new_plan_to_allow/,0,0.128,Positive
The federal government used to keep track of extreme weather disasters. Now it’s up to a nonprofit.,federal government use keep track extreme weather disaster nonprofit,spherocytes,2191,22,2025-10-22 16:34:26,https://www.reddit.com/r/technology/comments/1odd7w2/the_federal_government_used_to_keep_track_of/,3,-0.5574,Negative
Grounded jet engines take off again as datacenter generators,ground jet engine take datacenter generator,Loki-L,115,29,2025-10-23 08:19:20,https://www.reddit.com/r/technology/comments/1odxojw/grounded_jet_engines_take_off_again_as_datacenter/,3,0.0,Neutral
"OpenAI Weakened ChatGPT’s Self-Harm Guardrails in Lead-Up to Teen’s Death, Lawsuit Says | Adam Raine's family members added troubling new allegations to their existing lawsuit against the company.",openai weakened chatgpts selfharm guardrail leadup teen death lawsuit say adam rain family member add troubling new allegation exist lawsuit company,chrisdh79,45,10,2025-10-23 12:40:04,https://www.reddit.com/r/technology/comments/1oe26nx/openai_weakened_chatgpts_selfharm_guardrails_in/,4,-0.91,Negative
Trump Administration Cuts Cyberdefense Even as Threats Grow,trump administration cut cyberdefense even threat grow,rezwenn,24,4,2025-10-23 16:11:29,https://www.reddit.com/r/technology/comments/1oe7h0w/trump_administration_cuts_cyberdefense_even_as/,1,-0.6124,Negative
China's supercomputer breakthrough uses 37 million processor cores to model complex quantum chemistry at molecular scale — Sunway fuses AI and quantum science,chinas supercomputer breakthrough use million processor core model complex quantum chemistry molecular scale sunway fuse ai quantum science,Logical_Welder3467,121,23,2025-10-23 06:58:42,https://www.reddit.com/r/technology/comments/1odwge4/chinas_supercomputer_breakthrough_uses_37_million/,0,0.0,Neutral
Open AI acquires Sky (AI for gettin things done on the mac),open ai acquire sky ai gettin thing do mac,Dramatic_Dentist_621,0,0,2025-10-24 19:19:14,https://www.reddit.com/r/technology/comments/1of6sgh/open_ai_acquires_sky_ai_for_gettin_things_done_on/,1,0.0,Neutral
Reddit sues AI company Perplexity and others for 'industrial-scale' scraping of user comments,reddit sue ai company perplexity other industrialscale scrape user comment,baby_budda,797,164,2025-10-22 20:14:08,https://www.reddit.com/r/technology/comments/1odj6qj/reddit_sues_ai_company_perplexity_and_others_for/,4,0.0,Neutral
"OpenAI prioritised user engagement over suicide prevention, lawsuit claims | Family of teen who took his own life after ChatGPT use alleges chatbot maker intentionally weakened protections",openai prioritise user engagement suicide prevention lawsuit claim family teen take life chatgpt use allege chatbot maker intentionally weaken protection,Hrmbee,27,9,2025-10-23 14:36:24,https://www.reddit.com/r/technology/comments/1oe4yfu/openai_prioritised_user_engagement_over_suicide/,0,-0.6908,Negative
Hacking Lab Boss Charged with Seeking to Sell Secrets in Russia,hack lab boss charge seek sell secret russia,rezwenn,12,1,2025-10-23 18:42:29,https://www.reddit.com/r/technology/comments/1oebgm3/hacking_lab_boss_charged_with_seeking_to_sell/,4,-0.2023,Negative
Reddit’s ‘AI Scraping’ Lawsuit Is An Attack On The Open Internet,reddits ai scrape lawsuit attack open internet,StraightedgexLiberal,0,18,2025-10-24 20:57:33,https://www.reddit.com/r/technology/comments/1of98m0/reddits_ai_scraping_lawsuit_is_an_attack_on_the/,1,-0.6124,Negative
"With new acquisition, OpenAI signals plans to integrate deeper into the OS | The acquired firm was working on a tool to control macOS directly with AI",new acquisition openai signal plan integrate deeply os acquire firm work tool control macos directly ai,Hrmbee,0,5,2025-10-24 15:29:15,https://www.reddit.com/r/technology/comments/1of0tpf/with_new_acquisition_openai_signals_plans_to/,2,0.0,Neutral
Microsoft Outlook is getting an AI overhaul under new leaders,microsoft outlook get ai overhaul new leader,dapperlemon,0,16,2025-10-24 18:06:12,https://www.reddit.com/r/technology/comments/1of4x7j/microsoft_outlook_is_getting_an_ai_overhaul_under/,4,0.0,Neutral
"As Suspicious Drones Plague Germany, Officials Are Unsure How to Respond",suspicious drones plague germany official unsure respond,rezwenn,32,26,2025-10-23 09:21:20,https://www.reddit.com/r/technology/comments/1odymea/as_suspicious_drones_plague_germany_officials_are/,2,-0.5423,Negative
"Inside Rivian’s $4,500 electric bike gamble",inside rivian electric bike gamble,DonkeyFuel,26,38,2025-10-23 10:30:58,https://www.reddit.com/r/technology/comments/1odzqtg/inside_rivians_4500_electric_bike_gamble/,3,0.0,Neutral
OpenAI requested memorial attendee list in ChatGPT suicide lawsuit,openai request memorial attendee list chatgpt suicide lawsuit,Logical_Welder3467,46,17,2025-10-23 06:57:13,https://www.reddit.com/r/technology/comments/1odwflt/openai_requested_memorial_attendee_list_in/,4,-0.7506,Negative
Google’s Quantum Computer Makes a Big Technical Leap,google quantum computer make big technical leap,rezwenn,5,5,2025-10-23 19:13:40,https://www.reddit.com/r/technology/comments/1oecahd/googles_quantum_computer_makes_a_big_technical/,0,0.0,Neutral
"G.M. Previews Talking Cars, Cheaper Batteries and Other New Tech",gm preview talk car cheap battery new tech,rezwenn,3,11,2025-10-23 20:22:04,https://www.reddit.com/r/technology/comments/1oee2h0/gm_previews_talking_cars_cheaper_batteries_and/,0,0.0,Neutral
"Concept Car Catches on Fire at GM Design Studio, But Report of Massive Blaze Is Wrong, GM Says",concept car catch fire gm design studio report massive blaze wrong gm say,TripleShotPls,6,4,2025-10-23 18:03:05,https://www.reddit.com/r/technology/comments/1oeafjz/concept_car_catches_on_fire_at_gm_design_studio/,4,-0.705,Negative
Netflix goes ‘all in’ on generative AI as entertainment industry remains divided,netflix go generative ai entertainment industry remain divide,Logical_Welder3467,1977,517,2025-10-22 10:22:54,https://www.reddit.com/r/technology/comments/1od4h2j/netflix_goes_all_in_on_generative_ai_as/,3,0.4215,Positive
Alibaba prices AI glasses at $660 to rival Meta and launches ChatGPT challenger,alibaba price ai glass rival meta launch chatgpt challenger,Puginator,14,12,2025-10-23 13:36:26,https://www.reddit.com/r/technology/comments/1oe3gn0/alibaba_prices_ai_glasses_at_660_to_rival_meta/,2,0.128,Positive
Carney Plots ‘Talent Attraction’ Plan as US Upends H-1B Process,carney plot talent attraction plan we upend hb process,joe4942,155,46,2025-10-22 23:09:41,https://www.reddit.com/r/technology/comments/1odni3y/carney_plots_talent_attraction_plan_as_us_upends/,3,0.0,Neutral
"AI chatbots make mistakes with news content nearly half of the time, says study",ai chatbot make mistake news content nearly half time say study,BreakfastTop6899,294,33,2025-10-22 19:29:17,https://www.reddit.com/r/technology/comments/1odhzpy/ai_chatbots_make_mistakes_with_news_content/,0,-0.3612,Negative
Scientists create LED light that kills cancer cells without harming healthy ones,scientist create lead light kill cancer cell without harm healthy one,Existing_Tomorrow687,1178,59,2025-10-22 11:38:20,https://www.reddit.com/r/technology/comments/1od5tz3/scientists_create_led_light_that_kills_cancer/,0,-0.7298,Negative
Channel 4 Airs Entire Show Hosted By AI Presenter In UK Television First,channel air entire show host ai presenter uk television first,Forward-Answer-4407,0,9,2025-10-24 15:42:44,https://www.reddit.com/r/technology/comments/1of162o/channel_4_airs_entire_show_hosted_by_ai_presenter/,2,0.0,Neutral
"Over 800 public figures, including ""AI godfathers"" and Steve Wozniak, sign open letter to ban superintelligent AI",public figure include ai godfather steve wozniak sign open letter ban superintelligent ai,chrisdh79,1267,113,2025-10-22 10:28:12,https://www.reddit.com/r/technology/comments/1od4k9u/over_800_public_figures_including_ai_godfathers/,4,-0.5574,Negative
Ransomware surge exploits VPN flaws &amp; Microsoft 365 logins in APAC,ransomware surge exploit vpn flaw amp microsoft login apac,ninjascotsman,8,0,2025-10-23 15:16:28,https://www.reddit.com/r/technology/comments/1oe60cu/ransomware_surge_exploits_vpn_flaws_microsoft_365/,0,-0.34,Negative
Casio’ new ring watch straps a durable G-Shock to your finger,casio new ring watch strap durable gshock finger,TripleShotPls,483,101,2025-10-22 15:25:09,https://www.reddit.com/r/technology/comments/1odbbs9/casio_new_ring_watch_straps_a_durable_gshock_to/,2,0.0,Neutral
YouTube launches AI detection tool to spot deepfakes using creators' faces and voices,youtube launch ai detection tool spot deepfake use creator face voice,AdSpecialist6598,10,1,2025-10-23 12:58:40,https://www.reddit.com/r/technology/comments/1oe2lam/youtube_launches_ai_detection_tool_to_spot/,2,0.0,Neutral
AI teaches itself and outperforms human-designed algorithms,ai teach outperform humandesigne algorithm,MetaKnowing,0,3,2025-10-24 13:35:41,https://www.reddit.com/r/technology/comments/1oexxo1/ai_teaches_itself_and_outperforms_humandesigned/,1,0.0,Neutral
Trump Administration in Talks to Take Equity Stakes in Quantum-Computing Firms,trump administration talk take equity stake quantumcompute firm,rezwenn,12,4,2025-10-23 09:34:06,https://www.reddit.com/r/technology/comments/1odytaj/trump_administration_in_talks_to_take_equity/,3,0.0,Neutral
"US States Want To Ban VPNs, But Citizens Are Already Fighting Back - SlashGear",us state want ban vpns citizen already fight back slashgear,seeebiscuit,15980,862,2025-10-21 20:13:54,https://www.reddit.com/r/technology/comments/1ocnop1/us_states_want_to_ban_vpns_but_citizens_are/,1,-0.6597,Negative
Amazon claims the headline isn’t robots taking jobs as it reveals new cost-cutting robots | The Blue Jay robot’s ‘extra set of hands’ probably means Amazon’s warehouses will require fewer human hands,amazon claim headline be not robot take job reveal new costcutte robot blue jay robot extra set hand probably mean amazon warehouse require few human hand,Hrmbee,30,8,2025-10-23 04:13:04,https://www.reddit.com/r/technology/comments/1odtq1o/amazon_claims_the_headline_isnt_robots_taking/,2,0.1779,Positive
