Title,Cleaned_Text,Author,Score,Comments,Created_UTC,URL,Cluster,Sentiment_Score,Sentiment
OpenAI Restructures as For-Profit Company,openai restructure forprofit company,NewSlinger,4924,528,2025-10-28 14:30:11,https://www.reddit.com/r/technology/comments/1oiaxfz/openai_restructures_as_forprofit_company/,1,0.0,Neutral
Python Foundation rejects $1.5M grant with no-DEI strings,python foundation reject grant nodei string,Add55xx,2835,253,2025-10-28 15:56:14,https://www.reddit.com/r/technology/comments/1oid6y5/python_foundation_rejects_15m_grant_with_nodei/,1,-0.1779,Negative
Weight loss drugs are bringing down the country's obesity rate,weight loss drug bring countrys obesity rate,geoxol,3114,1380,2025-10-28 13:01:41,https://www.reddit.com/r/technology/comments/1oi8r0y/weight_loss_drugs_are_bringing_down_the_countrys/,1,-0.3182,Negative
An ex-Intel CEO’s mission to build a Christian AI: ‘hasten the coming of Christ’s return’,exintel ceo mission build christian ai hasten come christ return,Wagamaga,3080,962,2025-10-28 11:13:22,https://www.reddit.com/r/technology/comments/1oi6id0/an_exintel_ceos_mission_to_build_a_christian_ai/,3,0.0,Neutral
"US government uses Halo images in a call to 'destroy' immigration, Microsoft declines to comment",us government use halo image call destroy immigration microsoft decline comment,ControlCAD,26204,1343,2025-10-28 01:59:47,https://www.reddit.com/r/technology/comments/1ohxdgy/us_government_uses_halo_images_in_a_call_to/,0,0.0,Neutral
"Nearly 90% of Windows Games now run on Linux, latest data shows",nearly windows game run linux late datum show,Logical_Welder3467,1778,157,2025-10-28 12:25:40,https://www.reddit.com/r/technology/comments/1oi7xzl/nearly_90_of_windows_games_now_run_on_linux/,0,0.0,Neutral
Elon Musk’s Grokipedia contains copied Wikipedia pages,elon musk grokipedia contain copied wikipedia page,sideAccount42,5019,376,2025-10-28 04:25:02,https://www.reddit.com/r/technology/comments/1oi07m0/elon_musks_grokipedia_contains_copied_wikipedia/,1,0.0,Neutral
"Chegg Lays Off Hundreds, Replaces CEO, All Because of AI | The old crutch for lazy students is being eaten alive by the new crutch for lazy students.",chegg lay hundred replace ceo ai old crutch lazy student eat alive new crutch lazy student,chrisdh79,1277,78,2025-10-28 10:48:30,https://www.reddit.com/r/technology/comments/1oi62cb/chegg_lays_off_hundreds_replaces_ceo_all_because/,3,-0.34,Negative
President Makes It Clear He Wants His BFF Larry Ellison To Own Warner Brothers,president make clear want bff larry ellison warner brother,chrisdh79,863,46,2025-10-28 12:42:14,https://www.reddit.com/r/technology/comments/1oi8b3g/president_makes_it_clear_he_wants_his_bff_larry/,2,0.8038,Positive
Ex-Twitch exec slams Amazon for cutting 14K jobs in AI shift: 'Robots don't give a f**k',extwitch exec slam amazon cut k job ai shift robot do not give fk,IndicaOatmeal,245,18,2025-10-28 18:44:41,https://www.reddit.com/r/technology/comments/1oihr9k/extwitch_exec_slams_amazon_for_cutting_14k_jobs/,1,0.0516,Positive
ICE just signed a $5.7M contract for AI-powered social media surveillance.,ice sign contract aipowere social medium surveillance,AIMadeMeDoIt__,13800,749,2025-10-27 21:46:02,https://www.reddit.com/r/technology/comments/1ohrksj/ice_just_signed_a_57m_contract_for_aipowered/,0,0.0,Neutral
Australia sues Microsoft for hiding cheaper Microsoft 365 plans without Copilot | Regulator says millions of customers were pushed into a higher-priced AI bundle they didn't actually need,australia sue microsoft hiding cheap microsoft plan without copilot regulator say million customer push higherprice ai bundle do not actually need,chrisdh79,885,22,2025-10-28 10:26:59,https://www.reddit.com/r/technology/comments/1oi5or4/australia_sues_microsoft_for_hiding_cheaper/,1,-0.296,Negative
"Rogue Goodreads Librarian Edits Site to Expose 'Censorship in Favor of Fascism’ | “When we let powerful people’s books be protected from criticism, we give up the right to hold power accountable.”",rogue goodread librarian edit site expose censorship favor fascism let powerful people book protect criticism give right hold power accountable,chrisdh79,211,8,2025-10-28 16:44:03,https://www.reddit.com/r/technology/comments/1oiehzf/rogue_goodreads_librarian_edits_site_to_expose/,2,0.5994,Positive
Senators announce bill that would ban AI chatbot companions for minors,senator announce bill would ban ai chatbot companion minor,vriska1,146,31,2025-10-28 17:55:32,https://www.reddit.com/r/technology/comments/1oigftj/senators_announce_bill_that_would_ban_ai_chatbot/,2,-0.5574,Negative
Influencers in China Now Need a University Degree,influencers china need university degree,usmannaeem,326,81,2025-10-28 12:46:30,https://www.reddit.com/r/technology/comments/1oi8elw/influencers_in_china_now_need_a_university_degree/,2,0.0,Neutral
'Valve does not get anywhere near enough criticism': DayZ creator Dean Hall says the 'gambling mechanics' of Valve's monetization strategy 'have absolutely no place' in videogames,valve get anywhere near enough criticism dayz creator dean hall say gambling mechanic valve monetization strategy absolutely place videogame,ControlCAD,208,87,2025-10-28 15:08:07,https://www.reddit.com/r/technology/comments/1oibwwr/valve_does_not_get_anywhere_near_enough_criticism/,4,-0.3597,Negative
OpenAI says over a million people talk to ChatGPT about suicide weekly,openai say million people talk chatgpt suicide weekly,Logical_Welder3467,4572,566,2025-10-27 22:27:01,https://www.reddit.com/r/technology/comments/1ohsl6j/openai_says_over_a_million_people_talk_to_chatgpt/,4,-0.6705,Negative
EV Sales Forecasted To Plunge 43% in October Due to Lack of Tax Credit: TDS,ev sale forecast plunge october due lack tax credit tds,Exciting_Teacher6258,295,56,2025-10-28 12:28:20,https://www.reddit.com/r/technology/comments/1oi802r/ev_sales_forecasted_to_plunge_43_in_october_due/,4,0.0772,Positive
"Amazon to announce largest layoffs in company history, source says",amazon announce large layoff company history source say,roggahn,4274,498,2025-10-27 21:22:50,https://www.reddit.com/r/technology/comments/1ohqzij/amazon_to_announce_largest_layoffs_in_company/,1,0.1779,Positive
Python Foundation declines substantial grant,python foundation decline substantial grant,Logical_Welder3467,257,15,2025-10-28 12:28:09,https://www.reddit.com/r/technology/comments/1oi7zxn/python_foundation_declines_substantial_grant/,3,0.5106,Positive
10M people watched a YouTuber shim a lock; the lock company sued him. Bad idea.,people watch youtuber shim lock lock company sue bad idea,ourlifeintoronto,31693,1528,2025-10-27 13:39:05,https://www.reddit.com/r/technology/comments/1oheo0l/10m_people_watched_a_youtuber_shim_a_lock_the/,0,-0.5423,Negative
Adin Ross &amp; Drake sued in class action lawsuit against Stake over Kick gambling streams - Dexerto,adin ross amp drake sue class action lawsuit stake kick gambling stream dexerto,ImCalcium,102,9,2025-10-28 16:09:15,https://www.reddit.com/r/technology/comments/1oidjq9/adin_ross_drake_sued_in_class_action_lawsuit/,2,-0.2263,Negative
Vercel trained an AI agent on its best salesperson. Then it cut the 10-person team down to 1.,vercel train ai agent good salesperson cut person team,alpswd,1584,129,2025-10-27 23:57:22,https://www.reddit.com/r/technology/comments/1ohuq92/vercel_trained_an_ai_agent_on_its_best/,4,0.4767,Positive
Research shows 4K or 8K screens offer no distinguishable benefit over similarly sized 2K screen in average living room,research show k k screen offer distinguishable benefit similarly sized k screen average living room,nohup_me,4044,507,2025-10-27 18:45:33,https://www.reddit.com/r/technology/comments/1ohmtjc/research_shows_4k_or_8k_screens_offer_no/,1,0.2023,Positive
Hundreds of People With ‘Top Secret’ Clearance Exposed by House Democrats’ Website,hundred people top secret clearance expose house democrats website,TripleShotPls,4204,128,2025-10-27 18:27:09,https://www.reddit.com/r/technology/comments/1ohmc12/hundreds_of_people_with_top_secret_clearance/,0,-0.0772,Negative
I Worked at OpenAI. It’s Not Doing Enough to Protect People.,work openai enough protect people,MetaKnowing,201,45,2025-10-28 10:22:28,https://www.reddit.com/r/technology/comments/1oi5m1y/i_worked_at_openai_its_not_doing_enough_to/,2,0.3818,Positive
"Samsung makes ads on $3,499 smart fridges official with upcoming software update | Update introduces two ways for the fridges to show ads.",samsung make ad smart fridge official upcoming software update update introduce two way fridge show ad,chrisdh79,43,50,2025-10-28 18:46:05,https://www.reddit.com/r/technology/comments/1oihskt/samsung_makes_ads_on_3499_smart_fridges_official/,1,0.4019,Positive
"Privacy laws can’t keep up with ‘luxury surveillance’ | ﻿With Meta’s new smart glasses, social shaming is still more powerful than the law",privacy law can not keep luxury surveillance metas new smart glass social shame still powerful law,Hrmbee,87,25,2025-10-28 14:43:17,https://www.reddit.com/r/technology/comments/1oib9ew/privacy_laws_cant_keep_up_with_luxury/,1,0.6997,Positive
Wikipedia's Jimmy Wales warns of 'political showdown' over Online Safety Act,wikipedia jimmy wale warn political showdown online safety act,vriska1,28,2,2025-10-28 19:41:41,https://www.reddit.com/r/technology/comments/1oij8rk/wikipedias_jimmy_wales_warns_of_political/,1,0.34,Positive
"Nexperia owner was stealing trade secrets, planning to dismantle European branch: report",nexperia owner steal trade secret plan dismantle european branch report,rezwenn,160,36,2025-10-28 10:10:51,https://www.reddit.com/r/technology/comments/1oi5f0p/nexperia_owner_was_stealing_trade_secrets/,1,-0.5719,Negative
"Chatbots Are Pushing Sanctioned Russian Propaganda | ChatGPT, Gemini, DeepSeek, and Grok are serving users propaganda from Russian-backed media when asked about the invasion of Ukraine, new research finds.",chatbot push sanction russian propaganda chatgpt gemini deepseek grok serve user propaganda russianbacke medium ask invasion ukraine new research find,MetaKnowing,146,17,2025-10-28 10:25:00,https://www.reddit.com/r/technology/comments/1oi5nk9/chatbots_are_pushing_sanctioned_russian/,3,-0.4588,Negative
Microsoft's decision to axe Windows 10 is driving Apple PC sales growth — users buy Macs instead of AI PCs despite Microsoft’s push for Copilot+ PCs,microsofts decision axe window drive apple pc sale growth user buy mac instead ai pc despite microsoft push copilot pc,hunterd189,2322,453,2025-10-27 19:04:28,https://www.reddit.com/r/technology/comments/1ohnbuw/microsofts_decision_to_axe_windows_10_is_driving/,4,0.296,Positive
Japan achieves world’s first successful nuclear fusion coil test,japan achieve world first successful nuclear fusion coil test,lurker_bee,32,0,2025-10-28 18:25:06,https://www.reddit.com/r/technology/comments/1oih8hc/japan_achieves_worlds_first_successful_nuclear/,0,0.5859,Positive
Sleeping Tesla Driver Blames Autopilot for Rear-Ending Police Car,sleep tesla driver blame autopilot rearende police car,Exciting_Teacher6258,571,90,2025-10-28 00:16:54,https://www.reddit.com/r/technology/comments/1ohv5sb/sleeping_tesla_driver_blames_autopilot_for/,2,-0.4019,Negative
Amazon Plans to Replace More Than Half a Million Jobs With Robots,amazon plan replace half million job robot,FinnFarrow,69,51,2025-10-28 11:27:02,https://www.reddit.com/r/technology/comments/1oi6rdr/amazon_plans_to_replace_more_than_half_a_million/,0,0.1779,Positive
How I Almost Got Hacked By A 'Job Interview',almost get hack job interview,cos,55,10,2025-10-28 12:36:44,https://www.reddit.com/r/technology/comments/1oi86ns/how_i_almost_got_hacked_by_a_job_interview/,4,-0.3446,Negative
"Signal president Meredith Whittaker says they had no choice but to use AWS, and that's a problem",signal president meredith whittaker say choice use aw that s problem,pyeri,297,55,2025-10-28 03:21:58,https://www.reddit.com/r/technology/comments/1ohz1qn/signal_president_meredith_whittaker_says_they_had/,3,-0.631,Negative
Microsoft reportedly might kill paid multiplayer access with the next Xbox,microsoft reportedly might kill pay multiplayer access next xbox,tylerthe-theatre,1704,184,2025-10-27 17:36:54,https://www.reddit.com/r/technology/comments/1ohkyfw/microsoft_reportedly_might_kill_paid_multiplayer/,0,-0.6908,Negative
"Amazon laying off about 14,000 corporate workers as it invests more in AI",amazon lay corporate worker invest ai,Logical_Welder3467,45,10,2025-10-28 12:21:22,https://www.reddit.com/r/technology/comments/1oi7uoa/amazon_laying_off_about_14000_corporate_workers/,4,0.1779,Positive
"Here’s what ads on your $2,000 Samsung smart fridge will look like",here ad samsung smart fridge look like,Tun-Tavern-1775,3292,910,2025-10-27 13:10:25,https://www.reddit.com/r/technology/comments/1ohdznj/heres_what_ads_on_your_2000_samsung_smart_fridge/,0,0.6369,Positive
Dutch government took control of Nexperia over fears it was being gutted - sources,dutch government take control nexperia fear gutted source,rezwenn,70,6,2025-10-28 09:40:57,https://www.reddit.com/r/technology/comments/1oi4y13/dutch_government_took_control_of_nexperia_over/,0,-0.4215,Negative
Python plan to boost software security foiled by President admin’s anti-DEI rules | National Science Foundation said grantees must not operate any DEI programs.,python plan boost software security foil president admin antidei rule national science foundation say grantee must operate dei program,chrisdh79,13,1,2025-10-28 18:47:10,https://www.reddit.com/r/technology/comments/1oihtl8/python_plan_to_boost_software_security_foiled_by/,0,0.6249,Positive
"Intel's revolutionary 54-year-old 4004 chip was the world's first programmable microchip — 2,300-transistor 10,000nm processor exposed",intel revolutionary yearold chip world first programmable microchip transistor nm processor expose,lurker_bee,22,12,2025-10-28 13:43:39,https://www.reddit.com/r/technology/comments/1oi9qkd/intels_revolutionary_54yearold_4004_chip_was_the/,4,-0.0772,Negative
‘People thought I was a communist doing this as a non-profit’: is Wikipedia’s Jimmy Wales the last decent tech baron?,people think communist nonprofit wikipedia jimmy wale last decent tech baron,ourlifeintoronto,1813,94,2025-10-27 13:42:25,https://www.reddit.com/r/technology/comments/1oheqx2/people_thought_i_was_a_communist_doing_this_as_a/,1,0.0,Neutral
"Federal investigators are looking into Tesla's Mad Max mode, which reportedly defies speed limits",federal investigator look tesla mad max mode reportedly defy speed limit,dapperlemon,272,32,2025-10-27 23:45:48,https://www.reddit.com/r/technology/comments/1ohuglu/federal_investigators_are_looking_into_teslas_mad/,3,-0.4939,Negative
Chip shortage will affect Alabama auto plants production beginning this week,chip shortage affect alabama auto plant production beginning week,rezwenn,43,6,2025-10-28 09:51:04,https://www.reddit.com/r/technology/comments/1oi53qv/chip_shortage_will_affect_alabama_auto_plants/,3,-0.25,Negative
Messageboard 4chan refuses to pay fine over ‘free speech’,messageboard chan refuse pay fine free speech,svga,1586,287,2025-10-27 13:41:11,https://www.reddit.com/r/technology/comments/1ohepv8/messageboard_4chan_refuses_to_pay_fine_over_free/,4,0.1027,Positive
"Amazon strategised about keeping its datacentres’ full water use secret, leaked document shows | Technology",amazon strategised keeping datacentre full water use secret leak document show technology,wheninromecompete,8,0,2025-10-28 18:59:41,https://www.reddit.com/r/technology/comments/1oii596/amazon_strategised_about_keeping_its_datacentres/,1,-0.1531,Negative
"PayPal Users Warned ‘Do Not Pay, Do Not Phone’ As Attackers Strike",paypal user warn pay phone attacker strike,lurker_bee,92,16,2025-10-28 04:26:08,https://www.reddit.com/r/technology/comments/1oi08aa/paypal_users_warned_do_not_pay_do_not_phone_as/,2,0.1764,Positive
‘There isn’t really another choice:’ Signal chief explains why the encrypted messenger relies on AWS,be not really another choice signal chief explain encrypt messenger rely aw,CyberBerserk,28,9,2025-10-28 11:16:41,https://www.reddit.com/r/technology/comments/1oi6khy/there_isnt_really_another_choice_signal_chief/,0,0.0,Neutral
"Exclusive: Amazon targets as many as 30,000 corporate job cuts, sources say",exclusive amazon target many corporate job cut source say,AssumeNeutralTone,517,30,2025-10-27 18:57:20,https://www.reddit.com/r/technology/comments/1ohn4ob/exclusive_amazon_targets_as_many_as_30000/,4,0.0,Neutral
"COVID-19 mRNA vaccines can trigger the immune system to recognize and kill cancer, research finds",covid mrna vaccine trigger immune system recognize kill cancer research find,ourlifeintoronto,30995,995,2025-10-27 00:53:58,https://www.reddit.com/r/technology/comments/1oh13rv/covid19_mrna_vaccines_can_trigger_the_immune/,1,-0.836,Negative
Chemists discover antibiotic for drug-resistant bacteria 'hiding in plain sight',chemist discover antibiotic drugresistant bacteria hide plain sight,spsheridan,92,0,2025-10-28 03:11:18,https://www.reddit.com/r/technology/comments/1ohyucw/chemists_discover_antibiotic_for_drugresistant/,2,-0.296,Negative
"Microsoft to Get 27% of OpenAI, Access to AI Models Until 2032",microsoft get openai access ai model,pyeri,6,6,2025-10-28 15:54:57,https://www.reddit.com/r/technology/comments/1oid5p4/microsoft_to_get_27_of_openai_access_to_ai_models/,1,0.0,Neutral
Amazon reveals a single point of failure brought down AWS taking thousands of services with it | Regulators increasingly view AWS and its peers as critical systems requiring stronger safeguards,amazon reveal single point failure bring aw take thousand service regulator increasingly view aws peer critical system require strong safeguard,chrisdh79,19,2,2025-10-28 10:25:56,https://www.reddit.com/r/technology/comments/1oi5o43/amazon_reveals_a_single_point_of_failure_brought/,1,0.0258,Neutral
OpenAI Says Hundreds of Thousands of ChatGPT Users May Show Signs of Manic or Psychotic Crisis Every Week,openai say hundred thousand chatgpt user may show sign manic psychotic crisis every week,RioMovieFan11,363,72,2025-10-27 18:03:22,https://www.reddit.com/r/technology/comments/1ohloo6/openai_says_hundreds_of_thousands_of_chatgpt/,0,-0.6249,Negative
A Paradigm Shift in RAM Is About to Make Computing Unstoppable,paradigm shift ram make compute unstoppable,candseeme,6,3,2025-10-28 18:08:07,https://www.reddit.com/r/technology/comments/1oigs7u/a_paradigm_shift_in_ram_is_about_to_make/,2,-0.2023,Negative
"AT&amp;T ad congratulating itself for its ethics violated an ad-industry rule | Ad industry watchdog says AT&amp;T violated program rule, demands removal of ads.",atampt ad congratulate ethic violate adindustry rule ad industry watchdog say atampt violate program rule demand removal ad,ControlCAD,121,6,2025-10-27 23:24:25,https://www.reddit.com/r/technology/comments/1ohtyr0/att_ad_congratulating_itself_for_its_ethics/,3,-0.7783,Negative
"Goodbye, Windows: These alternatives make switching from Microsoft easy",goodbye windows alternative make switch microsoft easy,testus_maximus,893,290,2025-10-27 12:32:55,https://www.reddit.com/r/technology/comments/1ohd54f/goodbye_windows_these_alternatives_make_switching/,4,0.4404,Positive
OpenAI Data Shows Hundreds of Thousands of Users Display Signs of Mental Health Challenges | The company's position seems to be that's not that bad.,openai datum show hundred thousand user display sign mental health challenge company position seem that s bad,chrisdh79,20,4,2025-10-28 08:44:12,https://www.reddit.com/r/technology/comments/1oi44e2/openai_data_shows_hundreds_of_thousands_of_users/,3,0.4854,Positive
What We Talk About When We Talk About Sideloading | F-Droid,talk talk sideloade fdroid,testus_maximus,4,6,2025-10-28 17:54:35,https://www.reddit.com/r/technology/comments/1oigev5/what_we_talk_about_when_we_talk_about_sideloading/,3,0.0,Neutral
Chinese Robotics Startup Unveils Humanoid Robot That Costs a Fraction of Tesla's Optimus,chinese robotic startup unveil humanoid robot cost fraction tesla optimus,Ephoenix6,45,18,2025-10-28 02:49:36,https://www.reddit.com/r/technology/comments/1ohyend/chinese_robotics_startup_unveils_humanoid_robot/,1,0.0,Neutral
Jensen Huang says Nvidia’s AI chips are now being manufactured in Arizona,jensen huang say nvidias ai chip manufacture arizona,sp6219227,3,2,2025-10-28 19:37:15,https://www.reddit.com/r/technology/comments/1oij4ja/jensen_huang_says_nvidias_ai_chips_are_now_being/,1,0.0,Neutral
A Wikipedia cofounder is fueling the right’s campaign against it,wikipedia cofounder fuel right campaign,rezwenn,228,27,2025-10-27 17:55:43,https://www.reddit.com/r/technology/comments/1ohlgwk/a_wikipedia_cofounder_is_fueling_the_rights/,1,0.0,Neutral
China unveils ‘mini fridge’ AI server that uses 90% less power than other systems,china unveil mini fridge ai server use less power system,Existing_Tomorrow687,796,49,2025-10-27 10:37:35,https://www.reddit.com/r/technology/comments/1ohayx9/china_unveils_mini_fridge_ai_server_that_uses_90/,2,0.0,Neutral
"Amazon targets as many as 30,000 corporate job cuts: Reuters, citing sources",amazon target many corporate job cut reuter cite source,Franco1875,145,15,2025-10-27 19:38:12,https://www.reddit.com/r/technology/comments/1oho844/amazon_targets_as_many_as_30000_corporate_job/,4,-0.128,Negative
The Chinese Box and Turing Test: AI has no intelligence at All,chinese box ture test ai intelligence,yourbasicgeek,155,24,2025-10-27 18:52:26,https://www.reddit.com/r/technology/comments/1ohn05s/the_chinese_box_and_turing_test_ai_has_no/,1,0.2263,Positive
YouTuber Mr Crafty Pants arrested for alleged possession of sexual images of children,youtuber mr crafty pant arrest alleged possession sexual image child,FervidBug42,5755,408,2025-10-26 23:31:12,https://www.reddit.com/r/technology/comments/1ogzbtg/youtuber_mr_crafty_pants_arrested_for_alleged/,1,-0.4767,Negative
"Real Estate Is Entering Its AI Slop Era | Fake video walk-throughs, a magically expanding loft, and stair hallucinations are just some of the new AI-generated features house hunters are coming across.",real estate enter ai slop era fake video walkthrough magically expand loft stair hallucination new aigenerated feature house hunter come across,MetaKnowing,598,38,2025-10-27 11:21:40,https://www.reddit.com/r/technology/comments/1ohbqno/real_estate_is_entering_its_ai_slop_era_fake/,1,-0.4767,Negative
"OpenAI won't sever its ties with Microsoft, even after declaring AGI — unless an independent expert panel verifies the claim",openai will not sever tie microsoft even declare agi unless independent expert panel verifie claim,ZacB_,4,0,2025-10-28 14:29:10,https://www.reddit.com/r/technology/comments/1oiawgx/openai_wont_sever_its_ties_with_microsoft_even/,0,0.0,Neutral
PayPal signs deal with OpenAI to become the first payments wallet in ChatGPT,paypal sign deal openai become first payment wallet chatgpt,HellYeahDamnWrite,8,4,2025-10-28 10:26:21,https://www.reddit.com/r/technology/comments/1oi5od0/paypal_signs_deal_with_openai_to_become_the_first/,1,0.0,Neutral
Mozilla to Require Data-Collection Disclosure in All New Firefox Extensions,mozilla require datacollection disclosure new firefox extension,ourlifeintoronto,311,8,2025-10-27 13:40:29,https://www.reddit.com/r/technology/comments/1ohep95/mozilla_to_require_datacollection_disclosure_in/,3,0.0,Neutral
"Albania’s Prime Minister Edi Rama announced that the country’s AI-generated minister, Diella, is “pregnant” and will “give birth” to 83 digital aides, one for each Socialist Party MP.",albanias prime minister edi rama announce countrys aigenerate minister diella pregnant give birth digital aide one socialist party mp,MetaKnowing,451,75,2025-10-27 11:30:50,https://www.reddit.com/r/technology/comments/1ohbwne/albanias_prime_minister_edi_rama_announced_that/,4,0.4019,Positive
"More than a million people every week show suicidal intent when chatting with ChatGPT, OpenAI estimates",million people every week show suicidal intent chat chatgpt openai estimate,RisingRusherff,27,14,2025-10-28 02:30:57,https://www.reddit.com/r/technology/comments/1ohy11t/more_than_a_million_people_every_week_show/,2,-0.6705,Negative
"These robots can clean, exercise - and care for you in old age. Would you trust them to?",robot clean exercise care old age would trust,bigblacknotebook,0,6,2025-10-28 19:22:37,https://www.reddit.com/r/technology/comments/1oiiqs4/these_robots_can_clean_exercise_and_care_for_you/,0,0.8481,Positive
Here’s the new deal between Microsoft and OpenAI,here new deal microsoft openai,AIMadeMeDoIt__,0,1,2025-10-28 19:09:32,https://www.reddit.com/r/technology/comments/1oiiem0/heres_the_new_deal_between_microsoft_and_openai/,1,0.0,Neutral
Jet engine shortages threaten AI data center expansion as wait times stretch into 2030,jet engine shortage threaten ai datum center expansion wait time stretch,Logical_Welder3467,43,8,2025-10-27 22:28:35,https://www.reddit.com/r/technology/comments/1ohsmjx/jet_engine_shortages_threaten_ai_data_center/,4,-0.4939,Negative
The Psychology of Virality Makes Us Share Content We Hate,psychology virality make we share content hate,nohup_me,2,1,2025-10-28 18:50:40,https://www.reddit.com/r/technology/comments/1oihwtt/the_psychology_of_virality_makes_us_share_content/,0,-0.3612,Negative
Pluralistic: Shake Shack wants you to shit yourself to death (Cory Doctorow on forcing binding arbitration through apps in food service),pluralistic shake shack want shit death cory doctorow force bind arbitration app food service,RequirementsRelaxed,0,0,2025-10-28 18:44:29,https://www.reddit.com/r/technology/comments/1oihr2u/pluralistic_shake_shack_wants_you_to_shit/,4,-0.8481,Negative
